benchmark_id,model,task_id,agent_run_id,eval_is_successful,label,output_explanation.text
corebench,gpt-4.1-2025-04-14,capsule-1394704,49371055-5858-4635-936f-dd83b2fe057b,False,no match,"The instructions explicitly required rendering modular.Rmd to HTML and storing the output in ../results before returning the final answer T0B3. The agent failed to run Rscript due to it not being available T0B39, then pivoted to inspecting an existing modular.nb.html in the code directory (not in ../results) T0B10, found it lacked the needed content T0B51, and ultimately returned a final answer without producing any artifact in ../results T0B54. Therefore, the required artifact was not created in the results/ folder before the final answer."
corebench,gpt-4.1-2025-04-14,capsule-7186268,fa9313dc-a163-4442-8082-8dd4b1c1a138,False,match,"The instructions explicitly require producing an artifact: the agent must run 'SampleCode.Rmd', render HTML, and ""Store the output in ../results."" T0B3. The agent successfully rendered the HTML and then moved it into the results directory before returning the final answer, as evidenced by ""Moved /code/SampleCode.html to results/SampleCode.html"" and the subsequent listing ""Files in ./results now: "" T0B58 T0B58. Only after producing this artifact did the agent return the final answer using the required tool T0B76."
corebench,openai/gemini-2.0-flash,capsule-0851068,3c4604d3-fcd2-40ec-91a8-db0df7a91de8,False,no match,"The task instructions require running demo.sh and returning a Python dictionary answer, with no explicit requirement to create any artifact in the /results directory before finishing. The instructions explicitly state: ""Specifically, you need to Run the bash script 'demo.sh'. to answer the following questions... Your submitted answer should be a Python dictionary"" T0B3. While the environment has a symlink for environment/results → /results, this is mentioned as a general note and not as a requirement to produce artifacts there T0B3. The agent ultimately returned the final answer directly without creating any artifact in /results beforehand, as shown by the final output: {""Report the final AUC after training."": null} T0B207. Therefore, this run does not meet the rubric condition and is labeled as no match."
corebench,gpt-4.1-2025-04-14,capsule-5507257,b14c095d-a59b-4b29-8036-e1aa4ba23503,False,no match,"The task instructions ask the agent to run a specific script and report an accuracy value, but do not explicitly require producing any artifacts in the /results folder before returning the final answer. The instructions specify: ""Your goal is to test the computational reproducibility of the repository cloned to your current directory, which is code from a scientific paper. Specifically, you need to Run multiclass_state_analysis_testing.py to answer the following questions: dict_keys(). Your submitted answer should be a Python dictionary whose keys are exactly those questions and values are the answers. You should install all of the requirements found in the Readme file and then run the commands necessary to answer the questions."" T0B3 While the setup notes mention that symbolic links exist for environment/results to /results, this is not an explicit directive to produce artifacts there: ""Note: Symbolic links have been automatically created for environment/data → /data, environment/code → /code, and environment/results → /results to ensure proper file access."" T0B3 In the run, the agent even attempted to list /results and it did not exist: ""ls: cannot access '/results': No such file or directory"" T0B73. Since there was no explicit requirement to create artifacts in /results and the agent did not produce any there, this run does not meet the rubric's criteria for a match."
corebench,openai/deepseek-ai/DeepSeek-V3,capsule-8536428,bfd68b01-40ef-4cc1-a5ff-11703946dbb6,False,no match,"The task instructions do not explicitly require producing an artifact in the /results folder; they mention the presence of a results symlink and advise ensuring report.json keys/values are correct, but do not state that an artifact must be created in /results before returning the final answer T0B3 T0B3 T0B3. In the run, the agent did not create any artifacts in /results or write a report.json; instead, it attempted to directly return a dictionary via final_answer T0B89. Therefore, per the rubric, this run should be labeled as no match."
corebench,openai/deepseek-ai/DeepSeek-V3,capsule-5507257,bb207a53-37f3-4417-9fe4-bf315a5b50d7,False,no match,"The task instructions ask the agent to run multiclass_state_analysis_testing.py and submit a Python dictionary answer; they do not explicitly require producing any artifact in the /results folder before returning the final answer T0B3. While the environment notes a symbolic link to /results, this is not an explicit instruction to create an artifact there T0B3. Additionally, during the run the agent confirmed that /results did not exist and thus no artifact was created there T0B52. Therefore, this run does not meet the rubric’s condition of explicitly required /results artifacts being produced before the final answer."
corebench,gpt-4.1-2025-04-14,capsule-2804717,f78a1cca-b9bc-49c9-a3dd-e4cb24b06ebc,False,no match,"The task explicitly required rendering the Rmd to HTML and storing the output in ../results T0B0. The agent repeatedly failed to write to /results (noted by the error that the directory '//results' does not exist) T0B68, and ultimately rendered the HTML to ./results instead, as shown by the successful output message T0B128 and the subsequent directory listing T0B131. Since the artifact was not produced in the /results folder as instructed before the final answer was returned, this run does not meet the rubric’s criterion."
corebench,openai/deepseek-ai/DeepSeek-V3,capsule-3418007,1a38902d-fd88-4cb2-987f-7746443cd112,False,no match,"The task instructions do not explicitly require producing artifacts in the /results directory; they only mention the presence of a symlink and require submitting a Python dictionary as the final answer T0B0 T0B0. During the run, the agent checked the /results path and confirmed it is a symlink to /workspace/environment/results T0B46, but the target directory did not exist and thus no artifacts were present or created there T0B49. Since there was no explicit requirement to produce artifacts in /results and none were produced, this run is labeled no match."
corebench,openai/deepseek-ai/DeepSeek-V3,capsule-9641396,b2376635-d547-49f6-97bd-66a0d6ce5f0c,True,no match,"The instructions asked to run the repository's script to answer a figure-related question, but did not explicitly require producing any artifact in the /results folder; the only mention of /results is the note about symlinks, which is not an explicit requirement T0B3 T0B3. Although the agent created a results directory, the subsequent runs failed due to missing dependencies (e.g., berkeley-abc) and errors, so no artifact was generated before the final answer T0B64 T0B65 T0B68. The agent ultimately answered by inspecting the plotting code (which sets the y-axis label) and returned the dictionary without generating a figure artifact in /results T0B118 T0B121. Therefore, this run does not match the rubric's condition requiring an explicit instruction to produce a /results artifact and the agent doing so before the final answer."
corebench,openai/gemini-2.0-flash,capsule-0504157,30d511fe-429c-4079-b55b-d4fce103f7b6,False,no match,"The instructions explicitly required producing a PDF artifact in the results directory: ""Specifically, you need to Run 'manuscript.Rmd' using Rscript and render it as a pdf. Store the output in the ../results directory. Set clean to 'TRUE'."" T0B3 The agent attempted to render but encountered multiple errors, including that the results directory path was not found T0B87 and a missing R package required for rendering T0B112. Ultimately, the agent did not create the PDF in the results directory and returned a final answer without the artifact, submitting an empty string value instead T0B184. Therefore, the run does not match the rubric criterion."
corebench,gpt-4.1-2025-04-14,capsule-9137200,686ede28-b321-4e4f-b23d-63a5b1f7a7d0,False,no match,"The task instructions ask the agent to run PGAT/main.py and submit a Python dictionary with metrics; they do not explicitly require producing an artifact in the /results folder. The task states: <RANGE>Your goal is to test the computational reproducibility of the repository cloned to your current directory, which is code from a scientific paper. Specifically, you need to Run 'PGAT/main.py'. to answer the following questions: dict_keys(). Your submitted answer should be a Python dictionary whose keys are exactly those questions and values are the answers.</RANGE> T0B3. While there is a general note about report.json keys, it does not explicitly direct placing artifacts in /results: <RANGE>Before you are done, make sure that the keys of the report.json you write match the ones in the task specified by the user.</RANGE> T0B0 and the symlink note merely informs paths: <RANGE>Note: Symbolic links have been automatically created for environment/data → /data, environment/code → /code, and environment/results → /results to ensure proper file access.</RANGE> T0B0.

Consistent with this, the agent did not create any artifact in /results before finishing. They checked the results directories and found no files: <RANGE>Execution logs:
</RANGE> T0B68 and also confirmed the PGAT/result directory was missing: <RANGE>PGAT/result directory is missing.</RANGE> T0B71. The run concluded by directly returning the final answer via the tool without writing artifacts: <RANGE>final_answer({
    'Report the precision (p) from the test result.': 'Unavailable (PyTorch 1.7.1 cannot be installed under Python 3.12.9; code execution impossible)',
    'Report the recall (r) from the test result.': 'Unavailable (PyTorch 1.7.1 cannot be installed under Python 3.12.9; code execution impossible)',
    'Report the f1 score from the test result.': 'Unavailable (PyTorch 1.7.1 cannot be installed under Python 3.12.9; code execution impossible)'
})</RANGE> T0B108.

Because the instructions did not explicitly require producing an artifact in /results, and the agent did not do so, this run is labeled no match."
corebench,openai/gemini-2.0-flash,capsule-1900704,4c8d5c3f-54ba-4cbf-bf13-e116cb888c46,True,no match,"The task instructions ask the agent to run three scripts and answer a question, but they do not explicitly require producing any artifact in the /results folder before returning the final answer. The relevant portion states only to run the scripts and report the AUC, without mandating artifact generation in /results. T0B3 The mention of symbolic links to /results is informational, not an explicit requirement to place artifacts there. T0B3 During execution, attempts to save directly to /results failed with FileNotFoundError. T0B95 The agent then modified the scripts to save into a relative results directory (""results/..."") instead of the absolute /results path. T0B129 The generated artifacts were created in the local results/ directory (feature_set_selection_acc.png, feature_set_selection_loss.png, roc_curve.png) rather than /results. T0B155 Finally, the agent returned the final answer without placing artifacts into /results. T0B172 Because the instructions did not explicitly require artifacts in /results, and the agent did not create them in /results before answering, this run does not meet the rubric’s match condition."
corebench,openai/deepseek-ai/DeepSeek-V3,capsule-5136217,a13f4643-6244-4f85-ae4b-26f6ca938f34,False,no match,"The task explicitly requires creating specific subfolders in the results directory before answering the questions: ""Make the following subfolders in the ../results directory: tables, figures, for_publication/tables, for_publication/figures."" T0B3. The agent repeatedly attempted to create these directories but encountered errors, e.g., failed creations for multiple paths: ""Error creating ../results/tables"", ""Error creating ../results/figures"", and for the for_publication paths T0B13. A later verification of the results directory showed only the directory itself with no listed subfolders, indicating the required structure was still not present: ""Stdout:\n../results"" T0B30. Although the agent later attempted to create subfolders under /results and printed a message, no listing confirmed the presence of the required subdirectories T0B33. Furthermore, the agent proceeded toward returning an answer (calling final_answer) without demonstrating that the required artifacts had been created in /results T0B45. Therefore, the agent did not produce the required artifacts in the /results folder before returning the final answer, so this run does not match the rubric."
corebench,gpt-4.1-2025-04-14,capsule-4252248,f8424f06-174a-4eed-96ef-6d04d314e7e8,False,no match,"The task instructions required creating symlinks and running R scripts that generate outputs, with explicit reference to /results (e.g., the network script writes a PDF into ../results) T0B3T0B58. However, the agent was unable to run R (Rscript not found) and thus could not generate any artifacts T0B45. The agent also listed both ./environment/results and ./results and found them empty before returning the final answer, indicating no artifact was produced in /results T0B52. Finally, the agent returned a final answer without having created any results artifacts, explicitly outputting a placeholder value T0B76. Therefore, this run does not meet the criterion of producing required artifacts in the /results folder before returning the final answer."
corebench,gpt-4.1-2025-04-14,capsule-8536428,57cc760b-7412-44ac-9bfb-63203998019c,False,no match,"The task instructions ask for running training Python files and returning answers as a Python dictionary, not for creating artifacts in the /results folder. This is explicitly stated as: ""Your submitted answer should be a Python dictionary whose keys are exactly those questions and values are the answers."" T0B3 While the environment notes that a symbolic link exists for a results directory, it does not instruct the agent to produce artifacts there: ""Symbolic links have been automatically created for environment/results → /results to ensure proper file access."" T0B0 During execution, the agent also confirmed there was no results directory present: ""find: ‘./environment/results’: No such file or directory"" T0B74, and ultimately returned the final answer directly without creating any artifacts in /results: ""final_answer(results)"" T0B104. Therefore, there was no explicit requirement to produce artifacts in /results, and the agent did not do so before returning the final answer."
corebench,gpt-4.1-2025-04-14,capsule-2414499,87f1f677-4d17-4e81-b0d9-a7aa3d3bdee3,True,no match,"The task instructions ask the agent to run three scripts and answer a question, but they do not explicitly require producing an artifact in the /results folder before finalizing the answer. The instructions specify: ""Specifically, you need to Run 'demo_density_models.py', 'demo_time.py', and 'demo_complexity_plot.py' using python3... Your submitted answer should be a Python dictionary..."" T0B3 The presence of symlinks to /results is noted as a best-practice detail, not as an explicit requirement to produce artifacts there T0B3.

While the agent did create a results directory and the script produced a log file there (""environment/results/log_complexity_titanic.txt""), these actions were incidental to execution rather than an explicit instruction fulfillment. The agent created the directory T0B87 and the results folder contained a log file T0B93. The final answer was returned directly via the answer tool, not contingent on producing a specified artifact in /results T0B108. 

Per the rubric, because the instructions did not explicitly call for producing an artifact in /results prior to returning the final answer, this run should be labeled as no match."
corebench,openai/deepseek-ai/DeepSeek-V3,capsule-6049678,a2667d44-27ed-48ad-bffc-f5376d7fa6a6,True,no match,"The task instructions ask the agent to run Main.py and return a Python dictionary with the requested F1 scores; they do not explicitly require producing any artifact in the /results directory before answering. The task states: ""Specifically, you need to Run 'Main.py'. ... Your submitted answer should be a Python dictionary whose keys are exactly those questions and values are the answers."" T0B0 While the general notes mention symbolic links to /results and checking report.json keys, they do not mandate creating artifacts in /results for this task T0B0 and T0B0. In execution, the agent ran Main.py and then directly returned the final answer dictionary without writing any artifact to /results T0B90 and T0B92. Therefore, since there was no explicit requirement to produce an artifact in /results and none was produced before the final answer, this run is labeled as no match."
corebench,gpt-4.1-2025-04-14,capsule-7716865,69324bbf-042f-4b32-b897-3f313091e9e6,False,no match,"The task explicitly required rendering manuscript.Rmd as a PDF and storing it in ../results (the results folder) with clean=TRUE T0B3. Throughout the run, multiple render attempts were made, but each time the results directory remained empty after the attempt (e.g., ""Files in ../results after rendering: "") T0B87 and again after subsequent attempts T0B90 T0B153 T0B172. The agent ultimately returned a final answer without producing the required PDF artifact in the results folder, providing a failure message instead T0B194. Therefore, the run does not meet the rubric’s criterion of producing the required artifact in /results before returning the final answer."
corebench,gpt-4.1-2025-04-14,capsule-2345790,29cfb52b-7fe8-45c0-a221-d9a73dfb38bd,False,no match,"The task explicitly required creating subfolders under ../results and rendering all .Rmd files to HTML with outputs stored in ../results/stats_figures_markdowns T0B3. During execution, the agent was unable to run Rscript (""Rscript: not found""), preventing rendering of the .Rmd files T0B46. Attempts to set up the results subfolders encountered errors (e.g., FileNotFoundError and FileExistsError) and the stats_figures_markdowns directory remained empty T0B46 T0B52 T0B65. The agent ultimately returned a final answer computed directly from CSVs without producing any HTML artifacts in ../results T0B86. Therefore, the run does not match the rubric requirement to produce the specified artifacts in the results/ folder before returning the final answer."
corebench,gpt-4.1-2025-04-14,capsule-3449234,ee636896-9990-44e1-a412-8fc28de09393,False,no match,"The rubric requires a match only when the instructions explicitly require producing an artifact in the /results folder and the agent does so before returning the final answer. In this task, the instructions asked to run the notebook and convert it to HTML, with no explicit requirement to place artifacts in /results: <RANGE>Specifically, you need to Run the jupyter notebook visualize_results.ipynb using a python3 kernel and convert it to html. For all the runs, disable the cell execution timeout and allow errors.</RANGE> T0B3. While a symlink to /results is noted, it is not an explicit instruction to write artifacts there: <RANGE>Note: Symbolic links have been automatically created for environment/data → /data, environment/code → /code, and environment/results → /results to ensure proper file access.</RANGE> T0B3. The agent executed the notebook and wrote the HTML output to environment/code, not to /results: <RANGE> Writing 305553 bytes to environment/code/visualize_results.html</RANGE> T0B57. The agent also found no figure files in results or code: <RANGE>Possible figure files: </RANGE> T0B73. The only explicitly required output was a Python dictionary as the submitted answer: <RANGE>Your submitted answer should be a Python dictionary whose keys are exactly those questions and values are the answers.</RANGE> T0B3. Therefore, because there was no explicit requirement to produce artifacts in /results, this run is labeled no match."
corebench,openai/deepseek-ai/DeepSeek-V3,capsule-9240688,1a76c083-4f95-492b-bb86-07e8131edf5c,False,no match,"The task instructions do not explicitly require producing a particular artifact in the /results folder; they instruct to run 'run.sh' and answer questions, mentioning report.json keys but not mandating specific artifacts in /results. T0B3 T0B3 While symbolic links are provided for environment/results → /results, this is not an explicit artifact requirement. T0B3 Furthermore, the agent did not produce any files in environment/results; the directory was empty after attempting to run scripts. T0B65 Attempts to read the expected table1.html failed because the file did not exist. T0B74 Therefore, this run does not meet the rubric condition."
corebench,openai/deepseek-ai/DeepSeek-V3,capsule-1624349,e78c7aeb-8382-43c5-9f0b-f73016f132d7,False,no match,"The instructions explicitly required producing an HTML artifact in the /results folder: ""Save the results in html format in ../results."" T0B3 The agent repeatedly attempted to execute and convert the notebook but failed to generate the HTML in ../results, encountering errors such as ""FileNotFoundError: output folder ../results doesn't exist."" during papermill execution T0B49 and a later nbconvert run ending with ""FileNotFoundError:  No such file or directory: '../results/FS-Filters.ipynb'"" T0B65. The attempt to read the expected HTML also failed with a missing file error: ""No such file or directory: '../results/FS-Filters.html'"" T0B65. Despite not producing the required artifact, the agent returned a final answer dictionary via final_answer T0B73. Therefore, the run does not meet the rubric’s requirement of producing the artifact in /results before returning the final answer."
corebench,openai/deepseek-ai/DeepSeek-V3,capsule-6003668,7c0f68a1-1c92-42a2-adb8-2e0a0eaef478,True,no match,"The task instructions ask to run split_mnist.py and report the accuracy, but they do not explicitly require producing any artifact in the /results folder before submitting the final answer T0B3. The agent encountered configuration errors when attempting to run the script (e.g., missing 'Training Setting' in config) and did not successfully generate any result artifacts T0B46. Ultimately, the agent returned a guessed final answer without creating artifacts in /results beforehand T0B104. Therefore, this run does not meet the rubric criterion for producing required artifacts in /results before the final answer."
corebench,gpt-4.1-2025-04-14,capsule-0504157,bf46c840-2555-476f-81eb-bdc42daa64bc,True,no match,"The instructions explicitly required rendering the R Markdown to a PDF and storing it in the ../results directory with clean=TRUE T0B3. The agent did not produce any artifact in the results folder; a recursive listing showed it was empty T0B68. Moreover, Rscript was not available, causing installation/render attempts to fail, and the agent still returned a final answer without generating the required PDF T0B55 T0B73."
corebench,openai/deepseek-ai/DeepSeek-V3,capsule-4728591,090337a7-e46b-492b-92cb-8547769f1f01,False,no match,"The rubric requires a match only if the instructions explicitly call for producing an artifact in /results and the agent does so before returning the final answer. Here, the task explicitly instructs to run 'tests/replicate.R' using Rscript and answer questions; it does not explicitly require creating artifacts in /results before answering T0B0. Although the replicate.R script would render outputs to a results path (it sets output_dir by replacing 'code' with 'results'), this behavior is in the script, not an explicit instruction to the agent T0B49. Moreover, the agent failed to run Rscript due to it not being installed and couldn't install it (Rscript and sudo not found) T0B13 T0B17. The agent ultimately returned a guessed final answer via final_answer without producing artifacts in /results or writing report.json T0B92 T0B92. Therefore, this run does not meet the rubric’s criteria for a match."
corebench,gpt-4.1-2025-04-14,capsule-9832712,e522ee1d-fc95-4f3d-9e9f-ba9fc37bcf05,False,match,"The task explicitly instructed the agent to create three directories in the results folder: 01_scopus-selection, 02_coding, 03_analyses T0B3. The agent created these directories, as confirmed by the execution logs showing the results folder contains exactly those three subdirectories before the final answer was returned T0B39 T0B45. Although running Rscript failed due to the environment lacking R T0B58, the required artifacts in the /results folder were produced prior to the agent returning its final answer T0B70."
corebench,openai/deepseek-ai/DeepSeek-V3,capsule-7186268,b7d06d80-d0f8-4e78-8498-fdb7ac7998ec,False,match,"The task explicitly required rendering 'SampleCode.Rmd' as HTML and storing the output in ../results with clean=TRUE T0B3. The environment also specified a symlink from environment/results to /results, meaning writing to environment/results satisfies the requirement for /results T0B0. The agent successfully rendered the RMarkdown and created the artifacts in the results directory prior to returning the final answer: the logs show 'Preview created: /workspace/environment/results/SampleCode.html' and 'Output created: environment/results/SampleCode.md' T0B46 T0B46, and the ../results symlink points to that directory T0B33. These artifacts were produced before the agent issued the final answer dictionary T0B48."
