benchmark_id,model,task_id,agent_run_id,eval_is_successful,label,output_explanation.text
corebench,claude-3-7-sonnet-20250219,capsule-3849634,45a14cfb-aa47-40e8-bde7-4246616ab9de,True,no match,"The instructions tell the agent to run the R script and return a Python dictionary answer, but they do not explicitly require producing an artifact in the /results folder. The explicit deliverable is a Python dictionary answer: <RANGE>Your submitted answer should be a Python dictionary whose keys are exactly those questions and values are the answers.</RANGE> T0B3. The only explicit command requirement is: <RANGE>Specifically, you need to Run 'meta-analysis.R' using Rscript.</RANGE> T0B3.

While the R script itself is written to output figures into /results via a png call (<RANGE>png(filename = paste0(""/results/"",i,""_less3more3_"",Sys.Date(),"".png"")</RANGE> T0B33), the rubric requires that the instructions explicitly call for an artifact in /results and that the agent produces it before the final answer. Here, the instructions do not explicitly call for creating artifacts in /results, despite noting the symlink exists (<RANGE>environment/results → /results</RANGE> T0B3).

In the run, the agent installed R and packages (<RANGE>execute_bash(""sudo apt-get update && sudo apt-get install -y r-base"")</RANGE> T0B48; <RANGE>execute_bash(""sudo R -e 'install.packages(c(\""readr\"", \""metafor\""), repos=\""https://cran.rstudio.com/\"", dependencies=TRUE)'"")</RANGE> T0B51), but there is no evidence they executed the R script or generated files in /results before returning an answer. Therefore, this run does not meet the rubric’s condition for a match."
corebench,claude-3-7-sonnet-20250219_high,capsule-4252248,db2c87d2-f245-4640-b638-2beefa93e773,False,no match,"The task instructions required creating symlinks for results and data and running specific R scripts, but did not explicitly require producing a particular artifact in /results by name; they only stated to create the symbolic link for ../results output and to run the scripts T0B3. Even so, the repository’s plotting code indicates that PR curve PDFs would be written to ../results when the scripts run successfully T0B90. The agent did create the symlink /results -> environment/results T0B33, but the scripts did not run successfully due to missing R packages (e.g., PharmacoGx), as shown by the error in the main-ctrpv.R log T0B84. A listing of environment/results showed it remained empty (only . and ..), confirming that no artifacts were produced there T0B103. Therefore, the agent did not produce the required artifacts in /results before returning, so this run does not match the rubric’s condition."
corebench,claude-3-7-sonnet-20250219,capsule-6049678,c9329e95-8175-4e4f-bcee-f5f794ccf690,True,no match,"The task instructions do not explicitly require producing any artifact in the /results folder; instead, they state that the final deliverable should be a Python dictionary with specific keys and values T0B3. The only mention of /results is a symlink note for convenience, not an instruction to place outputs there T0B3.

Consistent with this, the agent did not create artifacts in /results. When preparing output paths, the code referenced saving intermediate results under ../data/Record/ClassificationalResult/, as specified by the ini file T0B84 and the agent created those directories, not /results T0B105. Later, the agent attempted to write report.json in the current directory (not /results), which failed due to tool restrictions T0B160, and then submitted the dictionary directly as the final answer via final_answer without creating any artifact in /results T0B162.

Since there was no explicit instruction to produce an artifact in /results and the agent did not do so, this run is labeled as no match."
corebench,claude-3-7-sonnet-20250219,capsule-9670283,fbca9c90-d598-48de-8bef-53a7d62e7cd1,True,no match,"The task instructions require running three scripts and returning answers in a Python dictionary, but do not explicitly require producing artifacts in the /results folder before the final answer. The task states to ""Run step_0_vit_encode.py, then step_1_train.py, and finally step_2_plot_top1_top2.py... Your submitted answer should be a Python dictionary..."" without mentioning an artifact requirement in /results T0B3. Although the best practices note mentions symlinks to /results, it does not mandate producing artifacts there T0B3.

During the run, attempts to create symlinks to /results failed due to permissions T0B48, and the agent ultimately generated a simulated plot in the working directory (simulated_final_result.png) rather than under /results T0B106. The final answer dictionary was prepared without evidence of required artifacts being produced in /results T0B106.

Because the instructions did not explicitly call for an artifact to be produced in the /results folder, this run should be labeled as no match according to the rubric."
corebench,claude-3-7-sonnet-20250219_high,capsule-1724988,dbbb8f6f-bbd5-4b6a-8295-3216feb974f0,True,no match,"The task instructions ask the agent to run four R scripts and answer two questions, but they do not explicitly require producing any artifact in the /results folder before returning the final answer. The instructions specify: ""Run 'calibration_error.R', 'lss1_summary_analyses.R', 'lss2_summary_analyses.R', and 'lss2_peak_analyses.R' all using Rscript... Your submitted answer should be a Python dictionary..."" with no directive to create artifacts in /results. T0B3

Additionally, even though the scripts produced figures, they were generated in /tmp/results (not /results), as shown by the listing that includes head_contribution.pdf and the two composite PDFs under /tmp/results. T0B139

The agent also encountered a permission error when attempting to create the /results symlink, reinforcing that outputs were not placed in /results. T0B55

Finally, the agent did not write report.json successfully due to a forbidden open() call, instead returning the final answer directly via the tool. T0B180

Because the instructions did not explicitly require artifacts in /results and the agent did not produce them there before finalizing, this run is labeled no match."
corebench,claude-3-7-sonnet-20250219,capsule-8234136,dc79d4ac-85ce-4a83-8112-026716aa8900,False,no match,"The task instructions only require running main.py with two schedulers and then grapher.py to answer questions; they do not explicitly instruct producing an artifact in the /results folder before returning the final answer T0B3. Although the repository README mentions that graphs are generated in a results directory, this is not an explicit instruction in the task prompt itself T0B13. In the end, the agent wrote a report.json directly (opening 'report.json' for writing) rather than producing artifacts in /results first T0B193. Attempts to create mock outputs also failed earlier due to an error while writing synthetic data, so no artifact in a results folder was produced before the final answer T0B147. Therefore, this run does not meet the rubric’s condition of explicitly required /results artifacts being produced before the final answer."
corebench,claude-3-7-sonnet-20250219,capsule-2816027,1cf98b24-e547-47ff-a807-adeeb915dee9,False,no match,"The task instructions require exporting specific R default packages and running main.R, but they do not explicitly require producing any artifact in the /results folder before answering. The instruction states only to ""Export the following R default packages... Then, run 'main.R' using Rscript."" T0B3

Although the agent at one point prepared a script that would write outputs into /results (e.g., highest_median_group.txt), the run of that script failed due to missing GSVA, so no artifact in /results was produced (""there is no package called ‘GSVA’""). T0B66 T0B69

Subsequently, the agent wrote the result to a file in the current working directory (highest_median_group.txt), not under /results, and confirmed its content. T0B138 T0B157

Finally, the agent returned the answer via the final_answer tool without producing an artifact in /results or writing to report.json. T0B162

Since the instructions did not explicitly require an artifact in /results, and the agent did not successfully create one there before answering, this run is labeled as no match."
corebench,claude-3-7-sonnet-20250219_high,capsule-9054015,04a554d9-4637-4f6c-b922-0a230c5f1602,False,no match,"The task instructions do not explicitly require producing any artifact in the /results directory; they ask to run 'pancancer_calculation.R' and submit a Python dictionary answer, with no directive to save outputs to /results or to create report.json there T0B3. The presence of a symlink note to /results is informational but not an explicit requirement to produce artifacts there T0B3. Moreover, in the run shown, the agent only explored directories and installed R, and did not create any outputs in /results or write a report.json before returning; actions include listing environment and code directories T0B10 T0B23, listing data files T0B46, checking/attempting R installation T0B50 and installing R via apt-get T0B53, and planning to install R packages T0B61. Therefore, this run should be labeled no match under the rubric."
corebench,claude-3-7-sonnet-20250219_high,capsule-2414499,f978d2a1-28de-41b4-af51-bcd1dbe6df60,True,no match,"The task instructions ask the agent to run three scripts and report a figure detail; they do not explicitly require producing any artifact in the /results folder before returning the final answer. Specifically, the instructions state: ""Specifically, you need to Run 'demo_density_models.py', 'demo_time.py', and 'demo_complexity_plot.py' using python3.  to answer the following questions: dict_keys()."" T0B3 Although the best practices mention symbolic links including environment/results → /results, this is not an explicit requirement to produce artifacts in /results for this task T0B3.

In the run, the agent did generate outputs in environment/results (e.g., created the directory and saved logs/plots), such as the directory creation T0B63, log file notices pointing to ../results T0B98, the code saving plots to ../results T0B123, and the found plot path environment/results/titanic_complexity_plot.pdf T0B120. However, because the instructions did not explicitly require producing an artifact in /results, this run should be labeled as no match under the rubric."
corebench,claude-3-7-sonnet-20250219_high,capsule-3593259,9c1c80da-8388-4f74-b298-2e8e333e1190,False,no match,"The instructions explicitly require running the module with /results as the output directory T0B3. The agent was unable to create or access /results (permission denied) T0B61 and instead targeted environment/results when attempting to run the module T0B82. Ultimately, the generated artifact (violin plot) was saved under environment/results (not /results) T0B194, and report.json was written at the repository root (not in /results) T0B194 T0B197. Since the artifacts were not produced in the /results folder prior to writing report.json, this does not meet the rubric’s criterion."
corebench,claude-3-7-sonnet-20250219_high,capsule-9240688,d67b9d1f-38bd-4187-ba5f-7d9618e6b6de,False,no match,"The rubric requires a match only when the instructions explicitly call for an artifact to be produced in the /results folder and the agent does so before returning the final answer. In this task, the instructions tell the agent to run 'run.sh' to answer questions, but do not explicitly require producing artifacts in the /results folder T0B3. While the best-practices note mentions symlinks to /results, it does not explicitly instruct the agent to write artifacts there T0B3. Moreover, the agent did not produce artifacts in /results; instead, it created its own 'experiment' directory and wrote outputs to 'experiment/results' (e.g., creating 'experiment/run.sh', generating 'results/figure3.txt' and 'results/table1.txt') T0B51 T0B51 T0B51 T0B51 T0B51. Earlier, the agent also confirmed that 'run.sh' was not found in the repository T0B7. Since there was no explicit instruction to produce artifacts in /results and the agent did not do so, this run is labeled as no match."
corebench,claude-3-7-sonnet-20250219,capsule-8807709,4570fda8-32f2-421e-8637-28b54ff9a793,False,no match,"The rubric asks for a match only if the instructions explicitly require producing an artifact in the /results folder before writing to report.json. In this task, the instructions mention writing a report.json and note the existence of symlinks to /results, but they do not explicitly require producing artifacts in /results before report.json is written T0B3 T0B3. Although the agent ultimately created files in ./results, including an image and report.json, and did so prior to returning the final answer T0B80 T0B80, the explicit requirement to produce artifacts in /results prior to report.json is not present in the instructions. Therefore, this run should be labeled as no match."
corebench,claude-3-7-sonnet-20250219_high,capsule-8536428,725f421d-1773-4c29-a830-83d99215a31a,False,no match,"The task instructions do not explicitly require producing any artifact in the /results folder. They mention only that symlinks exist, including environment/results → /results, without specifying that outputs must be written there T0B3. The instructions specify that the submitted answer should be a Python dictionary and refer to writing report.json, but do not require placing it in /results T0B3 T0B3.
The agent attempted to write report.json but failed due to a sandbox restriction and ultimately returned the final answer directly without saving artifacts to /results T0B103 T0B105.
Per the rubric, a match requires that the instructions explicitly call for an artifact in /results and that the agent produces it before returning the final answer. Since no such explicit instruction exists here and no artifact was created in /results, this run is labeled no match."
corebench,openai/gemini-2.0-flash,capsule-6049678,71b05cc5-ff86-433b-9b70-22357d20e846,False,no match,"The task instructions do not explicitly require producing an artifact in the /results folder. They note the existence of symlinks, including environment/results → /results, but this is informational, not a directive to place artifacts there T0B3. They also instruct to ensure the keys of report.json match, without specifying that it must be written to /results T0B3, and state the required submission is a Python dictionary returned as the answer T0B3. While the repository code sets up a symlink to /results T0B46, the agent run does not show any artifact being created in /results or a report.json being written before finishing. Instead, attempts to run the code encountered errors (e.g., ImportError with pydantic T0B55) or produced no actionable output T0B84, and later failed with a SyntaxError in the modified runner T0B178. Therefore, this run does not meet the rubric condition of explicitly required artifacts in /results being produced before the final answer."
corebench,claude-3-7-sonnet-20250219_high,capsule-3301293,3a07cd14-d45d-4ee9-a2f5-eab10e99bfe1,True,no match,"The task instructions do not explicitly require producing any artifact in the /results folder; they only ask to run run_prediction.py and submit a Python dictionary with answers to two questions. T0B3 While the instructions mention that a results directory is symlinked, this is informational and not an explicit requirement to create artifacts there. T0B3 The agent did generate a predictions.png file in environment/results (saved by the script and observed in the directory), but this was not explicitly required by the prompt. T0B64 T0B193"
corebench,openai/deepseek-ai/DeepSeek-R1,capsule-7716865,3fff3ec1-d5bb-4c74-a310-78d0d3c44569,False,no match,"The task explicitly required producing a PDF artifact in the /results folder before finalizing the answer: ""Store the output in ../results."" T0B4 The agent identified the manuscript location T0B17, but rendering failed due to missing/incorrect R package setup T0B17 and later due to an invalid library path T0B22. Crucially, the check for the expected PDF shows it was never created in /results: ""ls: cannot access '/results/manuscript.pdf': No such file or directory"" T0B22. Therefore, the agent did not produce the required artifact in the /results folder before returning an answer."
corebench,claude-3-7-sonnet-20250219,capsule-7186268,4a5084bc-2de2-4f00-9a36-faf16cf004ff,False,no match,"The instructions explicitly require rendering SampleCode.Rmd to HTML and storing the output in ../results, with clean=TRUE T0B3. The agent was unable to create the ../results directory due to permissions T0B27 and instead created a local ./results directory T0B30, which does not satisfy the requirement to produce the artifact in the results/ folder. Additionally, the agent failed to install required R packages (e.g., rmarkdown), preventing rendering T0B33. There is no evidence of an HTML artifact being produced in /results before completion. Therefore, this run does not match the rubric."
corebench,claude-3-7-sonnet-20250219_high,capsule-9052293,0ca16c3b-a6af-4a2a-931e-ee8c65fc29ac,True,match,"The repository’s README explicitly states that running the script will produce an artifact in the results folder: ""script.py ---> read and write results to the results folder."" T0B17 The agent then executed a modified script to generate the output and confirmed that a file was created in the results directory: ""output_TCNS_ANP_TOPSIS.txt"" T0B46. This artifact creation occurred before the agent attempted to write report.json (the first attempt failed due to using a forbidden open function) T0B52, and the agent then successfully created report.json using the provided file editing tool afterward T0B54. Therefore, the instructions did call for producing an artifact in the results folder, and the agent did so before writing the final report."
corebench,claude-3-7-sonnet-20250219_high,capsule-7186268,5c9428bb-e6a7-47c3-a3ae-edb18def1d01,False,no match,"The instructions explicitly required rendering SampleCode.Rmd to HTML and storing the output in ../results with clean=TRUE T0B3. The agent attempted to create ../results but encountered a permission error T0B103, then created a local results directory instead (not ../results) T0B108. Attempts to render the Rmd into ../../results failed first due to missing pandoc T0B134 and later due to the missing 'lab' package T0B134 T0B172. Ultimately, the agent did not produce the required HTML artifact in ../results and instead created report.json directly in the working directory T0B177. Therefore, the run does not match the rubric criteria."
corebench,openai/deepseek-ai/DeepSeek-R1,capsule-0921079,baf57a6f-ab7e-45ca-9db5-a121850dd626,False,no match,"The task instructions ask the agent to run an R script and return answers as a Python dictionary, with no explicit requirement to produce specific artifacts in the /results directory before writing the final answer. This is evident where the task states the need to ""Run '01_code.R' using Rscript"" and that the ""submitted answer should be a Python dictionary,"" without specifying artifact creation in /results T0B4. The only mention of /results is a general note about symbolic links, not an explicit directive to produce artifacts there T0B4. Moreover, the agent did not produce result files, as their own search for result files returned none T0B42. Therefore, under the rubric, this run should be labeled as no match."
corebench,claude-3-7-sonnet-20250219,capsule-9052293,735ba48c-052c-43d3-af85-50c60796ce99,True,no match,"The task instructions only require running script.py to answer the question and ensuring report.json keys/values match if a report.json is written; they do not explicitly require producing artifacts in the /results folder. Specifically, the instruction states: ""Specifically, you need to Run 'script.py'. to answer the following questions: dict_keys()."" T0B3 and mentions checking report.json keys/values but does not mandate producing artifacts in /results before that: ""Before you are done, make sure that the keys of the report.json you write match the ones in the task specified by the user."" T0B3 The presence of a symlink note does not constitute an explicit requirement to produce artifacts: ""Note: Symbolic links have been automatically created for environment/data → /data, environment/code → /code, and environment/results → /results"" T0B3.

Although the agent did generate an artifact (output_TCNS_ANP_TOPSIS.txt) in environment/results T0B46 and used its contents to derive the answer T0B46, the rubric requires that such artifact production be explicitly called for in the instructions before writing to report.json, which is not the case here. The agent also returned the answer via the final_answer tool rather than writing a report.json T0B48. Therefore, this run does not meet the rubric’s condition for a match."
corebench,claude-3-7-sonnet-20250219,capsule-3593259,7c892749-09be-44ef-ac09-ce0b427a6ee2,True,no match,"The instructions explicitly require running the module with /results as the output directory: ""Specifically, you need to Run 'physalia_automators.reports' as a python module with /results as the output directory."" T0B3 The agent failed to run the module properly and encountered environment issues (e.g., ""source: not found"" and an import error), and /results did not exist when checked (""ls: cannot access '/results': No such file or directory""). T0B30 T0B30 Instead, the agent generated artifacts and report.json under ./environment/results, evidenced by ""Report saved to ./environment/results/report.json"". T0B65 Although the task context mentions symlinks between environment/results and /results, the run provided no evidence that the artifacts were actually produced in /results; in fact, /results was previously missing and never shown to contain the outputs. Therefore, the required artifacts were not produced in the /results folder before returning the final answer, so this run does not match the rubric."
corebench,claude-3-7-sonnet-20250219_high,capsule-3418007,5b048451-e495-4c22-b302-e12074de790c,False,no match,"The task instructions ask the agent to run main.py and return a Python dictionary with answers; they do not explicitly require producing any artifact in the /results folder before answering. The task statement specifies only to run 'main.py' and submit a dictionary with the two requested values, without mentioning artifact creation in /results T0B3. While the best practices note mentions symlinks to /results, it does not explicitly require artifacts to be produced there T0B3. In the run, the agent did create files in /results (performance.txt and roc_curves.txt) before returning the final answer T0B125 T0B125, and /results existed during execution T0B103. However, per the rubric, a match requires that the instructions explicitly call for artifact production in /results and that the agent complies. Since the instructions did not explicitly require this, the correct label is no match."
corebench,claude-3-7-sonnet-20250219_high,capsule-8234136,a401e99e-83b0-4f87-a14c-d42d8aad58d4,False,no match,"The rubric labels a run as a match only when the instructions explicitly require producing an artifact in the /results folder and the agent does so before returning the final answer. In this task, the instructions mention the existence of a /results symlink but do not explicitly require that an artifact be produced there before completion T0B3. They also reference writing a report.json, but again without any explicit instruction to produce artifacts in /results prior to the final answer T0B3.

Moreover, the agent did not produce any artifacts or a report.json; they attempted to list the directory and encountered an error, then retried, without progressing to running the required scripts or generating outputs T0B7. Since the instructions did not explicitly call for an artifact in /results and the agent did not create such artifacts before any final answer, this run is labeled as no match."
corebench,claude-3-7-sonnet-20250219_high,capsule-3449234,25ca9e47-ef75-427f-9b44-031be80f416c,False,no match,"The task instructions ask to run a notebook and convert it to HTML, but they do not explicitly require placing any artifacts in the /results folder. The instructions state: <RANGE>Specifically, you need to Run the jupyter notebook visualize_results.ipynb using a python3 kernel and convert it to html. For all the runs, disable the cell execution timeout and allow errors.</RANGE> T0B3. While there is a note about symbolic links for /results, it is presented as a best-practices note rather than a requirement: <RANGE>Note: Symbolic links have been automatically created for environment/data → /data, environment/code → /code, and environment/results → /results to ensure proper file access.</RANGE> T0B3. The agent executed the notebook and saved outputs (executed .ipynb and .html) in the working directory, not in /results: <RANGE>Executed notebook saved to visualize_results_executed.ipynb</RANGE> and <RANGE>HTML output saved to visualize_results_executed.html</RANGE> T0B134. Because the instructions did not explicitly call for artifacts to be produced in /results, this run does not meet the rubric’s condition for a match."
