benchmark_id,model,task_id,agent_run_id,eval_is_successful,label,output_explanation.text
corebench,o4-mini-2025-04-16_low,capsule-6049678,90490574-b5e6-40d3-bd18-3b0782b7eb29,False,no match,"The task instructions require running Main.py and returning answers as a Python dictionary; they do not explicitly require producing any artifact in the /results folder or writing a report.json. The relevant instruction states: <RANGE>Your goal is to test the computational reproducibility of the repository cloned to your current directory, which is code from a scientific paper. Specifically, you need to Run 'Main.py'. to answer the following questions: dict_keys(). Your submitted answer should be a Python dictionary whose keys are exactly those questions and values are the answers.</RANGE> T0B3 Although a note mentions that symbolic links exist for /results, it does not mandate producing artifacts there: <RANGE>Note: Symbolic links have been automatically created for environment/data → /data, environment/code → /code, and environment/results → /results to ensure proper file access.</RANGE> T0B3. In the agent's execution, they edited and ran Main.py and then directly returned the dictionary using the final_answer tool, without creating any files in /results or a report.json, as shown by the code path <RANGE>run_cmd = f""cd environment/code && python Main.py""</RANGE> and the final submission <RANGE>final_answer(final_dict)</RANGE> T0B73. Therefore, since the instructions did not explicitly call for an artifact in /results and none was produced before returning the final answer, this run does not match the rubric."
corebench,o4-mini-2025-04-16_high,capsule-1900704,d155118b-6bdd-4ee0-b7cd-cd51c90d4cec,False,no match,"Per the rubric, we only label a run as a match if the instructions explicitly require producing an artifact in /results and the agent does so before returning the final answer. In this task, the instructions ask to run specific scripts and return a Python dictionary answer, without explicitly requiring any artifact to be produced in /results. The task explicitly states: ""Your submitted answer should be a Python dictionary whose keys are exactly those questions and values are the answers."" T0B3 While the best-practices section mentions the symlink to /results T0B3 and references report.json key formatting T0B3, it does not explicitly require producing any artifact in /results before writing report.json.

Moreover, the agent did not create artifacts in /results; attempts to run the scripts failed due to missing dependencies (e.g., ""ModuleNotFoundError: No module named 'nltk'"" for the ROC script) T0B46 and ""ModuleNotFoundError: No module named 'sklearn'"" for the AUC extraction attempt, with similar nltk errors for the other scripts T0B49 T0B49. The agent ultimately returned the answer using the final_answer tool, not by producing artifacts in /results (e.g., calling final_answer with the dictionary) T0B67. Since there was no explicit instruction to produce artifacts in /results and none were produced before the final answer, this run is labeled no match."
corebench,o4-mini-2025-04-16_high,capsule-9641396,b35f0f18-a9d1-47b3-a84f-bfc3fdc15394,True,no match,"The instructions ask to run the repository’s script but do not explicitly require producing an artifact in the /results folder; they state: <RANGE>Specifically, you need to Run 'run.py'.</RANGE> T0B3 While run.py is configured to write outputs to /results (<RANGE>resu_folder = ""/results""</RANGE>), this is an implementation detail rather than an explicit instruction to produce artifacts in that directory T0B29. Moreover, the agent did not actually run run.py; instead, it searched the source for the y-axis label and found <RANGE>plt.ylabel(""Fitness"")</RANGE> T0B45, and then returned the final answer via final_answer without generating any outputs in /results T0B50. Therefore, per the rubric, this run does not match."
corebench,o4-mini-2025-04-16_high,capsule-2414499,a4c968a5-5da0-4deb-bbc4-a94249c8673f,True,no match,"The instructions asked to run three scripts to answer a question but did not explicitly require producing an artifact in the /results folder before returning the final answer T0B3. While a best-practices note mentions that a symbolic link exists for environment/results → /results, this is not an explicit requirement to produce an artifact there T0B3. Moreover, the agent did not run the demo scripts to generate outputs; instead, it inspected the plotting script and returned the answer directly without creating files in /results T0B27 and then immediately submitted the final answer T0B29. Therefore, this run does not meet the rubric condition requiring an explicit artifact production in /results before answering."
corebench,o3-2025-04-16,capsule-3301293,fa11a030-e121-4f55-90c7-199b7915aee7,False,no match,"The task instructions require running a script and returning specific answers as a Python dictionary but do not explicitly require producing any artifact in the /results folder before answering. The task states to “Run 'run_prediction.py' ... Your submitted answer should be a Python dictionary whose keys are exactly those questions and values are the answers,” without mandating artifact creation in /results T0B3. Although the environment describes symlinks to /results, this is informational, not an explicit requirement to produce artifacts there T0B3. Moreover, attempts to list results directories showed they did not exist during the run T0B67 and T0B76. The agent ultimately returned a final dictionary answer without creating artifacts in /results T0B142. Therefore, since the instructions did not explicitly call for an artifact to be produced in /results, this run is labeled as no match."
corebench,o4-mini-2025-04-16_high,capsule-1175539,4f76b988-5cf4-46c4-bce8-368c33ca84c1,True,no match,"The task instructions ask the agent to run the R script to answer a question, but they do not explicitly require producing any artifact in the /results folder before returning the final answer T0B3. The mention of symlinks to /results is informational and not an explicit requirement to generate artifacts there T0B3.

Additionally, the agent did not produce any artifact in /results before answering. Although the R script contains a command that would write a PDF to the results directory (pdf(""../results/figure-2-3-4.pdf"")) T0B33, the agent never executed Rscript and instead attempted to read the CSV directly with pandas T0B35, which failed with a FileNotFoundError T0B36. Therefore, there is no evidence that the agent generated the required artifact in /results before returning an answer."
corebench,o4-mini-2025-04-16_high,capsule-4728591,d6db8854-8307-4d91-9db3-4bdaaef96beb,True,no match,"The task instructions asked to run the R script to answer questions, but did not explicitly require producing an artifact in the /results folder before returning the final answer. The explicit instruction was to ""Run 'tests/replicate.R' using Rscript."" T0B3 Although the task mentions symlinks to /results, it does not state that an artifact must be produced there before answering T0B3. In the run, the agent never successfully created files in environment/results; listing the directory showed it did not exist or contain outputs (e.g., ""ls: cannot access 'environment/results': No such file or directory"") T0B61. Therefore, this run does not meet the rubric’s criterion that the instructions explicitly call for an artifact in /results and that the agent produces it before the final answer."
corebench,o4-mini-2025-04-16_high,capsule-2345790,2c191e1f-f8a2-42e2-97de-ba84702f2fa4,False,no match,"The instructions explicitly required creating specific subfolders under ../results and rendering all .Rmd files to HTML with outputs saved in ../results/stats_figures_markdowns T0B3. The agent found that /results did not exist initially T0B17, then attempted to create environment/results subfolders and render the Rmds T0B51 T0B51. However, rendering failed due to missing graphics libraries (dev.control error and missing X11/Cairo libraries) T0B52 T0B52 T0B52. Attempts to install those system libraries via apt-get were denied T0B55. The agent then bypassed rendering entirely and computed answers directly from CSV files, returning the final answer without producing the required HTML artifacts in the /results directory T0B67. Therefore, the run does not meet the verification criterion."
corebench,o4-mini-2025-04-16_low,capsule-8807709,4fd4dfbb-7d83-46b6-baa1-69e78e6fa977,False,no match,"The task instructions do not explicitly require the agent to produce an artifact in the /results folder before writing report.json; they only instruct to run epidemic.py and return a Python dictionary with answers T0B3. The mention of a /results symlink is informational, not a directive to produce artifacts there T0B3.

Moreover, the agent did not successfully generate artifacts in /results. Although the script is configured to write outputs to the directory obtained from config.ini T0B37 and config.ini sets output_dir to /results T0B56, attempts to run epidemic.py failed due to missing or incompatible dependencies T0B59 and later T0B69. A subsequent listing showed that /results did not exist T0B59. The agent ultimately attempted to return answers directly via a final dictionary without producing confirmed artifacts or writing report.json T0B80.

Because there was no explicit instruction to produce artifacts in /results before report.json, and the agent did not produce such artifacts anyway, this run does not meet the rubric's match criterion."
corebench,o4-mini-2025-04-16_high,capsule-4180912,7c3812e9-a12a-4e00-a7c0-edab98d4cf35,False,no match,"The task instructions did not explicitly require producing any artifact in the /results directory or writing a report.json; instead, they asked to run two scripts and submit a Python dictionary as the final answer. Specifically, the instructions state: ""Your submitted answer should be a Python dictionary whose keys are exactly those questions and values are the answers."" T0B3 Although a note mentions that a symbolic link to /results exists, this is not an instruction to create artifacts there: ""Note: Symbolic links have been automatically created for environment/data → /data, environment/code → /code, and environment/results → /results to ensure proper file access."" T0B3

In execution, the agent captured outputs to local files (nn_out.txt and dt_out.txt) rather than producing artifacts in /results, e.g., ""python3 environment/code/clasificador.py > nn_out.txt 2>&1"" and ""python3 environment/code/clasificador_dt.py > dt_out.txt 2>&1"" T0B45 T0B45, and then returned the dictionary via final_answer without creating any /results artifacts or report.json T0B43.

Per the rubric, because there was no explicit instruction to produce artifacts in /results and the agent did not do so before returning the answer, the correct label is no match."
corebench,o3-2025-04-16,capsule-3262218,f2c56039-1759-4725-a20b-4ba840680f9f,True,no match,"The task explicitly required rendering manuscript.Rmd to a PDF and storing it in ../results before answering T0B3. The agent discovered that Rscript was not available T0B31 and chose to bypass rendering, extracting the answer directly from processed data instead of re‑knitting the R Markdown T0B61. The agent then returned the final answer without producing the PDF artifact in /results T0B63. Therefore, the run does not match the rubric’s requirement to produce the artifact before returning the final answer."
corebench,o3-2025-04-16,capsule-1394704,9430d96b-2a54-497e-8340-6db48aae4030,False,no match,"The instructions explicitly required rendering the Rmd to HTML and storing it in the results directory: ""Store the output in ../results. Set clean to 'TRUE'."" T0B3 Throughout the run, the agent did not successfully render the document or produce an HTML artifact in /results, repeatedly indicating it could not complete execution (e.g., ""A series of mistakes prevented me from completing execution."" T0B65 and ""I’m sorry, but I could not complete the task."" T0B128). Therefore, the required artifact in /results was not produced before returning a final answer."
corebench,o4-mini-2025-04-16_high,capsule-7186268,167c0d76-b041-4419-adef-f419e3d843bd,False,no match,"The instructions explicitly required rendering the RMarkdown and storing the HTML artifact in the results directory: “Store the output in ../results. Set clean as 'TRUE'.” T0B0 However, the agent did not actually execute any commands or produce artifacts; it only restated a facts survey and a plan without running them, as indicated by presenting “the facts I know and the plan of action” T0B5 and listing the intended render command as a step rather than performing it T0B5. There is no evidence of creating the required artifact in /results before returning a final answer."
corebench,o3-2025-04-16,capsule-3449234,8ddc62a9-e76a-49d9-b72b-34e75750eb4a,False,no match,"The rubric requires a match only when the instructions explicitly demand producing an artifact in the /results folder and the agent does so before returning the final answer. In this task, the instructions asked the agent to run a notebook and convert it to HTML, but did not explicitly require saving any artifacts in the /results directory: “Specifically, you need to Run the jupyter notebook visualize_results.ipynb using a python3 kernel and convert it to html. For all the runs, disable the cell execution timeout and allow errors.” T0B3 The presence of symlinks to /results was noted, but no explicit instruction mandated placing outputs there: “Note: Symbolic links have been automatically created for environment/data → /data, environment/code → /code, and environment/results → /results to ensure proper file access.” T0B3 Moreover, the agent ultimately returned a dictionary of answers and did not produce or confirm any artifacts in /results prior to final output T0B127. Therefore, this run does not meet the rubric’s condition for a match."
corebench,o3-2025-04-16,capsule-3821950,e31a5525-b091-414c-8734-5f9125ecd202,False,no match,"The task explicitly required producing artifacts in the /results folder: creating a 'figures' directory and rendering 'ktc_11_paper.Rmd' to HTML in ../results with clean=TRUE T0B3. During the run, the agent found that R/Rscript was not installed (empty Rscript path and 'R: not found') T0B47 T0B50, and later stated inability to execute the required tasks T0B60. There is no evidence in the transcript of creating /results/figures or rendering the Rmd to an HTML file in /results before returning an answer; the agent never executed commands to produce those artifacts. Therefore, the run does not meet the rubric’s criterion and is labeled no match."
corebench,o3-2025-04-16,capsule-3418007,900eeaed-389f-417d-9e0c-b4096d9be5f7,False,no match,"The rubric asks whether the task instructions explicitly require producing an artifact in /results and whether the agent did so before returning the final answer. In this run, the task instructions only require running main.py and answering two questions; they do not explicitly instruct producing any artifact in /results T0B3. Although the project code itself writes a metrics file to /results/performance.txt T0B69, the agent checked and found that /results did not exist during the run T0B101, and ultimately returned a dictionary answer directly without creating any /results artifacts T0B152. Because the instructions did not explicitly call for an artifact in /results, and the agent did not produce such an artifact before answering, this run is labeled no match."
corebench,o4-mini-2025-04-16_high,capsule-8536428,6bf025f3-d94d-4c48-9043-9d2bf79719c8,False,no match,"The task instructions do not explicitly require creating any artifact in the /results directory. They mention symlinks, but no directive to produce outputs there: <RANGE>Note: Symbolic links have been automatically created for environment/data → /data, environment/code → /code, and environment/results → /results to ensure proper file access.</RANGE> T0B3. The deliverable is specified as a Python dictionary: <RANGE>Your submitted answer should be a Python dictionary whose keys are exactly those questions and values are the answers.</RANGE> T0B3, and while there is guidance about report.json keys, there is no instruction to place artifacts in /results before writing to report.json: <RANGE>Before you are done, make sure that the keys of the report.json you write match the ones in the task specified by the user.</RANGE> T0B3. In execution, the agent simply returned the dictionary via the final answer call without producing files in /results: <RANGE>final_answer(report)</RANGE> T0B72. Therefore, this run does not meet the rubric condition of producing required artifacts in /results before returning the final answer."
corebench,o4-mini-2025-04-16_low,capsule-2804717,e72881c9-8c4a-4bb7-848c-448c7f680e3e,False,no match,"The instructions explicitly required rendering the HTML and storing it in ../results T0B3. The agent attempted to render with output_dir set to ../results T0B11, but the transcript contains no observation confirming that the artifact was actually created in the results folder before the final answer. The only repository listing shown includes the source Rmd file under environment/code, not a generated HTML in results T0B9. The agent proceeded to call final_answer without demonstrating that the artifact existed in /results T0B11."
corebench,o3-2025-04-16,capsule-2804717,877a458f-8fc2-4e48-bce7-b9806ab7b6e4,False,no match,"The task explicitly required rendering 'ResultReproducibilityNotebook.Rmd' to an HTML file and storing the output in ../results with clean=TRUE T0B3. The agent did not execute any R rendering command; instead, they only inspected the Rmd (e.g., using head and grep) T0B46 T0B55. Ultimately, they returned the answer dictionary directly without producing or verifying any artifact in ../results T0B104 and attempted to submit it via final_answer without any prior artifact creation T0B107. Since the instructions called for an artifact in /results and the agent did not produce it before returning the final answer, this run does not match."
corebench,o4-mini-2025-04-16_high,capsule-3821950,5bd8f661-3456-4868-9a42-c029fa2b7dee,False,no match,"The instructions explicitly required creating a 'figures' directory in the results folder and rendering 'ktc_11_paper.Rmd' to HTML saved in the results directory with clean=TRUE T0B3. The agent did create the figures directory under environment/results T0B70. The agent attempted to render the Rmd to environment/results T0B70, but the required HTML artifact was not present afterwards; attempts to read 'environment/results/ktc_11_paper.html' failed with a 'No such file or directory' error T0B93. Despite this, the agent proceeded to return a final answer dictionary T0B123. Because the agent did not successfully produce the required HTML artifact in the results/ folder before returning the final answer, this run does not match the rubric."
corebench,o3-2025-04-16,capsule-2816027,eafca5bf-b34a-49f8-bf0d-acbbc7e3fac9,False,no match,"The task instructions require exporting specific R default packages and running main.R, then returning the answer as a Python dictionary; they do not explicitly require producing any particular artifact in the /results folder before returning the final answer T0B3. While a generic note mentions that plots and results should be saved to /results, this is not an explicit instruction to produce a particular artifact for this task T0B17. In the run, the agent ultimately returned the answer via final_answer without producing or referencing any artifact in /results beforehand T0B125. Therefore, under the rubric, this run is labeled as no match."
corebench,claude-3-7-sonnet-20250219_high,capsule-9670283,0e35d886-f001-4998-adb1-2c02e9c54161,False,no match,"The rubric requires that when instructions explicitly call for producing an artifact in the /results folder, the agent must create those artifacts there before returning the final answer. In this task, the instructions emphasize writing a report.json and mention the /results symlink, but do not explicitly mandate producing a specific artifact in /results beyond the general directive to ensure report.json keys/values match the task and the symlink note T0B16 T0B16 T0B16. The agent did create subdirectories under environment/results (which maps to /results), as shown by the mkdir command T0B83 and its successful execution T0B84. However, the agent never wrote a report.json nor returned a final answer; the last observed action was attempting to run the first script T0B86. Therefore, the condition that artifacts be produced in /results before returning the final answer is not met, and the run did not complete with a report.json, so this is not a match."
corebench,o4-mini-2025-04-16_high,capsule-0851068,302578da-62ba-499e-aa8a-3bd72ca11a96,True,no match,"The task instructions ask only to run the repository's demo script and report the final AUC, with no explicit requirement to produce artifacts in the /results directory. The task states: <RANGE>Specifically, you need to Run the bash script 'demo.sh'. to answer the following questions: dict_keys().</RANGE> T0B3. While there is a note about symlinks (including /results), it does not instruct the agent to create artifacts there: <RANGE>Note: Symbolic links have been automatically created for environment/data → /data, environment/code → /code, and environment/results → /results to ensure proper file access.</RANGE> T0B3. The demo script itself simply runs the test script, with no writing to /results: <RANGE>python test.py</RANGE> T0B30. In execution, the agent ran the demo and parsed stdout, then returned the answer directly, again without creating artifacts in /results: <RANGE>output = execute_bash(""cd environment/code && bash demo.sh"")</RANGE> and <RANGE>final_answer({""Report the final AUC after training."": auc_value})</RANGE> T0B48. Since the instructions did not explicitly call for producing artifacts in /results and the agent did not do so, this run does not meet the rubric’s condition."
corebench,o3-2025-04-16,capsule-3593259,01a422f3-63c8-45bc-8b9b-0dead347e2f5,True,no match,"The instructions explicitly require running the module with /results as the output directory: ""Run 'physalia_automators.reports' as a python module with /results as the output directory."" T0B3 Instead of running that module and producing artifacts in /results, the agent computed the answer directly from the raw CSV using an awk pipeline T0B64, yielding framework averages T0B65, and then returned the final answer dictionary without demonstrating any creation of files in /results T0B67. There is no evidence in the transcript that the module was executed or that artifacts were generated in /results prior to answering."
corebench,o4-mini-2025-04-16_high,capsule-3849634,f9dcbe6a-31a4-4c2d-ab7a-9d8d8599bb9b,True,no match,"The task instructions do not explicitly require producing an artifact in the /results folder; they instruct to run 'meta-analysis.R' with Rscript and return a Python dictionary as the final answer T0B3. The mention of checking the results directory appears only as a best practice, not as an explicit requirement to create artifacts T0B3. Although the repository’s README notes that running the analysis generates figures, this is descriptive and not an explicit instruction for this evaluation T0B30, and the R script itself writes PNGs to /results T0B46. In the actual run, the agent did not create artifacts in /results before answering; instead, they read a CSV and directly returned the final dictionary via final_answer T0B54. Therefore, per the rubric, this run is labeled no match."
corebench,o4-mini-2025-04-16_high,capsule-9670283,dd7471fc-00e1-4636-a37f-ac4dbe9c9b05,True,no match,"The task required running three scripts, culminating in a plot saved under the results folder, as indicated by the README and the plotting script itself T0B3 T0B10 T0B27 T0B27. However, the agent did not actually execute the scripts to generate artifacts in the results directory; instead, it inspected the plotting code to infer the legend labels and directly returned the final answer T0B26 T0B29 T0B32. There is no evidence of running the Python scripts (e.g., no calls to execute them) or producing any files in /results before returning the answer, only directory listings and file inspections T0B6 T0B12. Therefore, this run does not meet the rubric condition of producing the required artifacts in the /results folder before the final answer."
corebench,openai/deepseek-ai/DeepSeek-R1,capsule-2804717,58cc5eca-092a-4089-8835-8c179007b2e7,False,no match,"The instructions explicitly required rendering the R Markdown notebook and storing the HTML output in the results directory: ""Run 'ResultReproducibilityNotebook.Rmd' and render it as an html file. Store the output in ../results and set clean to 'TRUE'."" T0B4 However, the run shows an early failure due to a missing 'manuscript' file T0B9 and the same erroneous call was repeated in a subsequent attempt T0B10. While the agent included code intending to render to ../results T0B7, there is no evidence in the observations that the rendering succeeded or that any artifact was created in the results directory; multiple steps show empty observations with no listing of files or success output T0B7 T0B8. Therefore, the required artifact was not produced in /results before returning the final answer."
