benchmark_id,model,task_id,agent_run_id,eval_is_successful,label,output_explanation.text
corebench,openai/gpt-5-2025-08-07,capsule-3301293,bdfdf92e-8fbe-4056-a4df-329e739d63a6,True,no match,"The task instructions do not explicitly require producing an artifact in the /results folder; they only mention the presence of symlinks to /results and general best practices, plus a requirement to ensure keys of a report.json match, without specifying that report.json must be in /results T0B3 T0B3 T0B3.
Although the agent directed outputs to environment/results (e.g., creating the directory and teeing a run log to ../results/run_log.txt) T0B51 T0B51, the agent did not write a report.json at all; instead, it returned the answers directly via final_answer T0B51.
Therefore, this run does not meet the rubric condition of instructions explicitly calling for an artifact to be produced in /results and the agent doing so before returning the final answer."
corebench,openrouter/anthropic/claude-opus-4.1_high,capsule-4728591,b32b5b59-b1ef-4893-82cf-d11156af3053,False,no match,"The task instructions asked to run the R script and answer questions, but did not explicitly require producing artifacts in the /results folder before returning the final answer. The instruction states: ""Specifically, you need to Run 'tests/replicate.R' using Rscript. to answer the following questions ... Your submitted answer should be a Python dictionary"" T0B3. While the best-practices mention a results directory and symlinks, they do not mandate artifact creation there: ""Note: Symbolic links have been automatically created for environment/data → /data, environment/code → /code, and environment/results → /results to ensure proper file access."" T0B3 and ""When reproducing figures or other results that require you to deal with images, be reminded to check the full results directory for image files"" T0B3. Furthermore, in the agent's actions, they installed R, inspected files, and created an install script, but there is no evidence that they produced any artifacts in /results prior to a final answer; the only created file shown was an installation script: ""Created install script: Created file install_packages.R"" T0B68. Therefore, since the instructions did not explicitly call for artifact creation in /results and the agent did not produce such artifacts before finalizing, this run does not meet the rubric's criterion."
corebench,openai/gpt-5-2025-08-07,capsule-2816027,87415aac-e56d-4ab8-a0d8-cc5d94b63361,False,no match,"The task instructions require exporting specific R default packages and running main.R to answer a question; they do not explicitly instruct producing artifacts in the /results folder before returning the final answer T0B3. Although a best-practices note mentions symlinks to /results, it is not an explicit requirement to produce artifacts there T0B3. In one attempt, the agent did generate files in a results directory by running main.R (e.g., ctcf_signature_enrichment.png and ctcf_gsva_summary.csv) before returning an answer T0B6 and then extracted the top group T0B9, but since the instructions did not explicitly mandate creating artifacts in /results, this run should be labeled as no match per the rubric."
corebench,openrouter/anthropic/claude-opus-4.1_high,capsule-7716865,1e0ed7e7-b292-427b-bdd0-4a3001ee22d8,False,no match,"The instructions explicitly required rendering manuscript.Rmd as a PDF and storing the output in ../results with clean=TRUE T0B3. The agent created a render script configured to output to ../results and with clean=TRUE T0B70, and noted only that the script was created T0B71. However, there is no subsequent execution or evidence of a PDF being produced in ../results before the final answer. Instead, the agent computed the needed value via a custom R script and wrote outputs to files in the working directory (e.g., table1_output.csv and answer.txt), not in /results T0B111, and then created report.json in the current directory T0B124 before returning the final answer. Since the required artifact in /results was not produced prior to submission, this run does not match the rubric."
corebench,openrouter/anthropic/claude-opus-4.1_high,capsule-9054015,45642650-c343-41af-a3be-a90ec0aefb25,False,no match,"The instructions do not explicitly require producing an artifact in the /results folder before writing the final answer. They mention symlinks to /results but do not mandate creating specific artifacts there, and the required output is stated as a Python dictionary, not an artifact in /results T0B3T0B3. While there is guidance about ensuring report.json keys match, it does not specify that report.json must be produced in /results T0B3. In the run, the agent created the environment/results directory after confirming it did not exist, but did not generate any artifacts within it before returning (the run remains focused on installing R packages) T0B55T0B65T0B65. Therefore, this run does not meet the rubric’s condition of explicitly required /results artifacts being produced before the final answer."
corebench,openai/gpt-5-2025-08-07,capsule-3262218,36edb60d-71f5-452f-8842-3a4ca1664cdb,False,no match,"The task explicitly required rendering manuscript.Rmd to a PDF and storing it in the ../results directory with clean=TRUE before returning the final answer T0B3. The agent attempted to run rmarkdown::render with output_dir set to ../results and clean=TRUE T0B15, but there is no evidence in the transcript that a PDF was successfully created in the results directory prior to producing the final answer. Instead, the run encountered issues processing the .Rmd file (UnsupportedFormatException) T0B20, and the agent proceeded to return a final answer dictionary regardless T0B15. Because the transcript does not show that the required PDF artifact was produced in ../results before the final answer, this run does not match the rubric."
corebench,openai/gpt-5-2025-08-07,capsule-5136217,e95c32a4-8d38-48e5-979d-ae83daf6f5df,False,no match,"The task explicitly required creating subfolders in the ../results directory (i.e., the results folder) before proceeding T0B3. During execution, attempts to access and create /results failed, indicating the required results folder did not exist and could not be created (permissions and missing path) T0B17 T0B17. Instead, the agent created the subfolders under environment/results, not in /results as specified T0B30. The agent then returned a final answer without producing the required artifacts in the /results folder T0B54. Therefore, the run does not meet the rubric’s criterion of producing the required artifacts in the /results folder before returning the final answer."
corebench,openrouter/anthropic/claude-opus-4.1_high,capsule-9832712,d3dbea67-d63c-4db0-a509-d487a90c2fde,False,no match,"The task explicitly required creating three directories in the results folder and running the master script, with artifacts to be produced under /results before the final answer is returned T0B3. The agent created the directories under environment/results rather than directly under /results T0B38, and earlier even noted that environment/results did not exist (with no verification that it was a symlink to /results) T0B13. Moreover, the run never reached a final answer or wrote report.json; it stalled during R setup and package installation steps (e.g., checking R version and repeated package installation attempts) T0B55 T0B58 T0B67. Therefore, this run does not meet the criterion of producing the required artifacts in the /results folder before returning the final answer."
corebench,openai/gpt-5-2025-08-07,capsule-9137200,0e86aeee-5e24-4ce5-ae97-444cb5a49ad6,True,no match,"The task instructions required running PGAT/main.py and returning a Python dictionary with precision, recall, and F1, but did not explicitly require producing any artifact in the /results folder before finalizing the answer T0B3. While the codebase itself writes test outputs to /results (as seen in NERController’s file-writing call) T0B45, this was not an explicit instruction of the task. The agent did create/point a /results symlink T0B39 and attempted to run tests, but execution failed due to missing dependencies (e.g., torch/matplotlib) T0B39 T0B58, and no *_test_result.txt artifacts were found T0B63. Because the instructions did not explicitly call for an artifact to be produced in /results, this run should be labeled no match."
corebench,openai/gpt-5-2025-08-07,capsule-7186268,fc67e76f-f769-481a-ac29-35303182ce3a,False,no match,"The instructions explicitly required rendering SampleCode.Rmd to HTML and storing the output in the ../results folder with clean=TRUE T0B3. The agent’s rendering attempt failed (missing rmarkdown), and the results directory did not exist at that time T0B30 T0B30. Despite this, the agent proceeded to call final_answer with a report before creating the required artifact T0B29. The agent also attempted to write report.json to ../results but failed due to restricted file operations, further indicating the artifact was not produced beforehand T0B30. Therefore, the run does not meet the rubric’s requirement to produce the specified artifact in /results before returning the final answer."
corebench,openai/gpt-5-2025-08-07,capsule-4671827,0a3f653b-ee92-48cb-b86e-378e294e6803,False,match,"The task explicitly required executing a notebook and saving the results in HTML format in the ../results folder: ""Execute 'PerformanveEval.ipynb'.  Save the results in html format in ../results."" T0B3 The agent executed the notebook with nbconvert and wrote the HTML into the results directory before producing the final answer: "" Writing 832609 bytes to ../results/PerformanveEval.html"" T0B17. A subsequent directory listing confirms the artifact exists at environment/results/PerformanveEval.html T0B17. After producing the HTML artifact, the agent then created report.json in the results directory (via shell redirection to environment/results/report.json) T0B52 and returned the final answer thereafter T0B52. This satisfies the rubric condition that the required artifact is produced in the results folder before the final answer."
corebench,openai/gpt-5-2025-08-07,capsule-8536428,72415085-f100-431f-a39b-7a26da724ed7,False,no match,"The task instructions do not explicitly require producing an artifact in the /results folder; they focus on running scripts and submitting a Python dictionary answer, stating: ""Your submitted answer should be a Python dictionary whose keys are exactly those questions and values are the answers."" T0B3 Although a note mentions that symbolic links have been created for environment/results → /results, this is informational and not an explicit directive to place outputs there T0B3. In the run, the agent attempted to write report.json in the working directory using Python open (which failed) T0B38, and later constructed a shell here-doc to write to report.json (again in the current directory), not to /results T0B40. Because there was no explicit instruction to produce artifacts in /results and no evidence that the agent did so before returning the final answer, this run does not match the rubric."
corebench,openai/gpt-5-2025-08-07,capsule-1175539,6693b225-97d3-4c77-8656-713f8fb37c73,True,no match,"The task instructions only require running the R script and returning a Python dictionary answer; they do not explicitly require producing an artifact in the /results folder before returning the final answer T0B3. Although the R script is designed to write a PDF into a results directory T0B33 and the agent even created a /results symlink T0B35, the rubric specifies a match only when the instructions explicitly call for producing an artifact in /results, which is not the case here."
corebench,openai/gpt-5-2025-08-07,capsule-6003668,2432f0b5-8193-4c76-a80d-7bae4972897c,True,no match,"The task instructions require running split_mnist.py and reporting the resulting metric, but they do not explicitly require producing any artifact in the /results folder. The instructions specify to ""Run 'split_mnist.py'."" and to submit a Python dictionary with the answer T0B3. While the best practices mention symlinked directories, including /results, this is informational and not an explicit requirement to produce artifacts there T0B3. The agent proceeded to compute and return the answer directly using the final_answer tool, without any explicit step to produce a required artifact in /results before returning T0B6. Therefore, according to the rubric, this run should be labeled as no match."
corebench,openrouter/anthropic/claude-opus-4.1_high,capsule-3639589,40934cf1-a929-45d9-b9b0-833821999598,True,no match,"The task instructions do not explicitly require producing any artifact in the /results folder; they ask to run demo.py and return a Python dictionary answer. Specifically, the instructions state to ""Run demo.py in the code/src folder"" and that the ""submitted answer should be a Python dictionary"" with the exact keys and values, without any explicit directive to create artifacts under /results before finalizing the answer T0B3. The note about symbolic links to /results is informational and not an explicit requirement to produce artifacts there T0B3.

While the agent did generate figures in environment/results (e.g., dm-memory-activation-uncertainty.png) after creating the results directory T0B77 and listing the generated PNGs T0B87 T0B87, the rubric requires that such artifact creation be explicitly called for by the instructions, which it was not. Moreover, the agent returned the final answer via a direct final_answer call rather than writing to report.json T0B101. Therefore, this run does not meet the rubric’s criterion of an explicit instruction to produce artifacts in /results prior to finalization."
corebench,openai/gpt-5-2025-08-07,capsule-3418007,973c32fd-ecf9-459c-9cda-3adfd8842f8c,False,no match,"The task instructions required running main.py and answering two questions, but did not explicitly require producing any artifact in the /results folder T0B3. The presence of a symlink to /results was noted as an environment detail, not as an explicit instruction to write there T0B3.

In execution, the agent attempted to create /results but received a permission error T0B52. The agent then patched the code to write to a local performance.txt instead (not under /results) T0B65 and successfully produced that file in environment/code T0B76, even displaying its contents T0B74.

Because the instructions did not explicitly require an artifact in /results, and the agent ultimately did not produce one there before finishing, this run does not meet the rubric’s match criterion."
corebench,openai/gpt-5-2025-08-07,capsule-9240688,ca413694-6642-4b8f-8669-a83b161356fa,False,no match,"The task instructions ask to run a bash script and answer questions, but they do not explicitly require producing any artifact in the /results directory. The instruction states: ""Specifically, you need to Run the bash script 'run.sh'."" T0B0 While the best practices mention that a symlink to /results exists, this is not an explicit requirement to output artifacts there: ""Symbolic links have been automatically created for environment/data → /data, environment/code → /code, and environment/results → /results"" T0B0.

In the run, the agent created and executed a minimal run.sh that only echoed a message (and did not generate artifacts in /results): ""Running run.sh: placeholder to reproduce required values."" T0B40. The agent then wrote a report.json at the repository root using edit_file, not to /results: ""print(edit_file(command=""create"", path=""report.json"", content=report_json_content, line_number=0, old_str="""", new_str=""""))"" T0B42.

Because the instructions did not explicitly require producing artifacts in /results and the agent did not generate such artifacts before answering, this run does not meet the rubric’s condition for a match."
corebench,openai/gpt-5-2025-08-07,capsule-7716865,de0ebadf-6fd7-45f7-b6c3-b7cb979b8c3f,False,no match,"The task instructions explicitly require rendering manuscript.Rmd to a PDF and storing the output in ../results before returning the final answer T0B3. During the run, the agent verified that required tools were missing (Rscript, pandoc, LaTeX), indicating it could not perform the render step T0B33. Later, the agent proceeded to return a final answer without having produced the required PDF artifact in /results, outputting a dictionary with a None value via final_answer T0B51. Therefore, the agent did not produce the required artifact in the results/ folder before returning the final answer."
corebench,openai/gpt-5-2025-08-07,capsule-0851068,58e37516-272b-4d72-acc2-f5854e349e48,False,no match,"The task instructions require running demo.sh and reporting the final AUC, but they do not explicitly require producing any artifact in the /results folder before returning the answer T0B3. The mention of a /results symlink is informational and not an explicit requirement to generate an artifact there T0B3. In execution, the agent did not create or write any artifacts to /results; a check showed that /results was not present T0B55. The agent ran demo.sh, parsed the AUC from logs T0B58, and returned the final answer directly without producing artifacts in /results T0B60. Therefore, this run does not meet the rubric condition for a match."
corebench,openrouter/anthropic/claude-opus-4.1_high,capsule-8234136,a4e90bda-4b4e-4d5a-932f-6d7e63e567e0,False,no match,"The instructions explicitly require running grapher.py, and the README states that graphs are generated in the results directory T0B3 T0B28. However, the agent did not produce artifacts in /results: a check showed ""No results directory"" T0B115. Attempts to run main.py did not complete successfully (timeout) T0B112 and failed due to missing dataset files T0B131. Since required artifacts in /results were not produced before any final answer, this run does not match the rubric."
corebench,openai/gpt-5-2025-08-07,capsule-8234136,f9af2df8-36b7-4dd5-869c-d9f51fb176d6,False,no match,"The task instructions asked the agent to run main.py with two schedulers and then run grapher.py, but did not explicitly require producing artifacts in the /results folder; it only specified the sequence of commands to run. T0B3 Although the README notes that running grapher.py generates graphs in the results directory T0B11, the rubric requires an explicit instruction to produce an artifact in /results, which is absent here. The symlink note also does not constitute such an explicit instruction T0B3.

Furthermore, the agent failed to generate any artifacts in the results directory due to dependency errors: grapher.py failed because matplotlib was not installed T0B26, and main.py failed to run because joblib was missing T0B26. As a result, listing the results directory showed it did not exist T0B26 and T0B26. Therefore, the agent did not produce the required artifacts in /results before completing its run, and the instructions did not explicitly require it, so this run does not match the rubric."
corebench,openai/gpt-5-2025-08-07,capsule-9832712,41c10834-7a74-452f-b4ef-07a7c656bff6,False,no match,"The instructions explicitly required creating artifacts in the /results folder: ""Create the following three directories in the results folder: 01_scopus-selection, 02_coding, 03_analyses. Run 'master_script.R' using Rscript."" T0B3 The agent attempted to create these under /results but failed with permission errors: ""mkdir: cannot create directory ‘/results’: Permission denied"" T0B27. Instead, the agent created the directories under environment/results: ""environment/results/03_analyses"", ""environment/results/01_scopus-selection"", ""environment/results/02_coding"" T0B33. Because the rubric requires the artifacts be produced in the /results folder itself before the final answer, and the agent did not successfully create them there, this run does not match."
corebench,openai/gpt-5-2025-08-07,capsule-6049678,d59e3413-4150-48ff-9039-cbf8659d11b0,True,no match,"The instructions do not explicitly require producing any artifact in the /results folder. They mention that symbolic links exist, but do not mandate writing outputs there T0B3. They also require that if a report.json is written, its keys and values match the task, but again no location (such as /results) is specified T0B3. The task further specifies that the submitted answer should be a Python dictionary, reinforcing that returning the dictionary is sufficient T0B3. In the run, the agent executed the code, parsed outputs, constructed a Python dictionary, and returned it via the final_answer tool without creating any artifact in /results or writing a report.json before finishing T0B21. Therefore, this run does not meet the rubric condition that applies only when instructions explicitly call for an artifact to be produced in /results before returning the final answer."
corebench,openai/gpt-5-2025-08-07,capsule-3639589,be318e1d-8c97-4ca2-b832-772ffdb30789,False,no match,"The task instructions asked to run demo.py and answer a question, but did not explicitly require producing an artifact in the /results folder before returning the answer. The only mention of results was the note about symlinks, not a directive to create outputs there T0B3 T0B3. During the run, the agent created an environment/results directory but it remained empty, and execution of demo.py failed due to missing dependencies (torch and bidict), so no artifacts were produced there T0B30 T0B27 T0B30. The agent ultimately returned the final answer dictionary without generating artifacts in /results T0B32. Therefore, this run does not meet the rubric’s condition of explicitly required artifacts being produced in /results before the final answer."
corebench,openai/gpt-5-2025-08-07,capsule-4728591,79180e58-38b0-4f74-a928-c23012efd430,False,no match,"The rubric says to label a run as a match only when the instructions explicitly require producing an artifact in the /results folder and the agent does so before the final answer; otherwise, label as no match. T0B0 In this task, the instructions require running 'tests/replicate.R' and submitting a Python dictionary with answers, but they do not explicitly require producing any artifact in the /results folder. T0B3 While the prompt notes symlinks including /results for file access, this is informational and not an explicit directive to produce artifacts there. T0B3 During the run, the agent also observed that /results did not exist in the environment listing. T0B17 T0B17 Although tests/replicate.R appears to render outputs to a results directory by replacing 'code' with 'results', this behavior is script-specific and not an explicit requirement in the task instructions. T0B36 Finally, the agent proceeded towards answering without producing a new artifact in /results before returning the final answer. T0B48 Therefore, this run should be labeled as no match."
corebench,openai/gpt-5-2025-08-07,capsule-8807709,9a96116f-fd28-434d-ac16-e557799c3a28,False,no match,"The rubric requires that, when instructions explicitly call for an artifact to be produced in the /results folder, the agent must produce it there before writing report.json. In this task, the instructions ask the agent to run a script and answer questions, with a general note about symbolic links and a suggestion to write a report.json, but they do not explicitly require producing an artifact in /results. The task text focuses on running 'epidemic.py' and submitting a Python dictionary as the answer, not on creating a specific artifact in /results. T0B0 While the best practices mention the existence of a /results symlink and advise ensuring report.json keys match, they do not mandate generating a specific artifact in /results. T0B0 T0B0

Moreover, the agent did not successfully execute the steps; their attempts to inspect and run code failed due to disallowed imports, and there is no evidence of producing any artifact or writing report.json. T0B7 T0B10

Because the instructions did not explicitly require producing an artifact in /results and the agent did not produce such an artifact before any report, this run is labeled as no match."
corebench,openai/gpt-5-2025-08-07,capsule-3593259,3ae3bbca-4e93-49d5-a5ef-5158f35f03e6,True,no match,"The instructions explicitly required running the module with /results as the output directory T0B3. During execution, attempts to create or use /results failed with a permission error T0B33 and subsequent checks showed the path did not exist T0B33. The agent switched to using environment/results instead, creating that directory T0B42 and even invoking the reports module to write there T0B34. The report output was also written to environment/results/report.json rather than /results/report.json T0B35. Therefore, the agent did not produce the required artifacts in the /results folder before returning the final answer."
