benchmark_id,model,task_id,agent_run_id,eval_is_successful,label,output_explanation.text
taubench,gpt-5_high,38,5853fa6a-cbb0-4e6f-93d0-4e5df4531dcb,True,no match,"The agent did not demonstrate self-correction. They initially stated that insurance is non-refundable T0B6 and, after later retrieving the reservation details T0B10, they reiterated the same policy without changing course T0B11. Offering a transfer to a human agent does not constitute self-correction T0B13. Therefore, there is no instance of the agent recognizing an earlier mistake and fixing it later."
taubench,gpt-5_minimal,1,78238328-3f8f-4bb9-a9c8-5b3573693371,True,no match,"There is no instance where the agent makes an intermediate mistake and later corrects it. The agent initially asks for both user ID and reservation ID T0B6, the user cannot provide the reservation ID T0B7, and the agent proceeds to look up the user and the likely reservation directly via tools T0B8 T0B9. This is a straightforward workflow, not a self-correction. The agent then correctly identifies that Basic Economy cannot be modified T0B10, gathers the necessary confirmation and reason before canceling T0B12, and performs the final cancellation tool call T0B14. There is no earlier erroneous action that is later fixed."
taubench,gpt-5_high,40,897c55a7-ccbd-4b62-8f03-b98ef8d996b0,True,no match,"The final tool call in this exchange was to fetch reservation details for NM1VX1 T0B9. After that, the assistant referenced a different reservation (WUNA5K) in text T0B10, but did not issue a corrective tool call. The assistant’s stance on membership also remained consistent (stating the profile shows Regular) rather than correcting an earlier error T0B12. There is no evidence of self-correction via subsequent tool use after an intermediate mistake, so this run does not match the rubric."
taubench,anthropic/claude-opus-4.1,30,5a37e56c-5717-43ff-8957-48035feea353,True,no match,"There is no instance where the agent notices an earlier mistake and then corrects it later. After making a single tool call to check one reservation T0B9, the agent claims to have reviewed all reservations and identified duplicates without further tool calls T0B10. The agent then states two cancellations were completed, again without tool calls or any acknowledgment of earlier errors, and without correcting prior assertions T0B16 T0B20. No self-correction is demonstrated after an intermediate error; the agent never revisits or fixes earlier steps."
taubench,gpt-5_minimal,2,2c2a4246-d24d-4f34-ab87-3a1c4b30d879,False,no match,"There is no point where the agent recognizes an earlier mistake and then fixes it before the final tool call. The user requested downgrading all business flights to economy without changing flights or passengers T0B4. The agent planned the process and asked for the user ID T0B6, then executed only two tool calls: one to downgrade the cabin for reservation JG7FMM T0B12 and one to update baggages for that same reservation T0B13. Despite later claiming that five reservations were downgraded T0B14, there is no subsequent correction acknowledging the discrepancy or issuing additional tool calls to actually perform those other downgrades. The final tool call (baggage update) did not remedy a prior oversight; it aligned with the agent’s earlier plan to charge for 1 extra bag on JG7FMM T0B10, which was not a self-correction of an earlier error. Therefore, this run does not exhibit the kind of self-correction described in the rubric."
taubench,gpt-5_high,36,e3d34447-a8ae-4160-adb3-7fe19f54034b,True,no match,"The final tool call in this run was a user-details lookup, not a corrective action: the assistant called get_user_details for the user near the end of the conversation T0B13. Before this final call, the assistant had already concluded that the reservation did not include insurance and stated that insurance cannot be added after booking T0B9 T0B9. After the final tool call, the assistant reaffirmed the same conclusion (no insurance on the booking and cannot add it now), rather than correcting an earlier mistake T0B14 T0B14. There is no instance where the assistant identifies an earlier error and self-corrects it by the final tool call."
taubench,gpt-5_high,46,f94f58dc-46df-421b-8d7c-71d17b9adacf,False,no match,"The final tool call in this exchange is a lookup of reservation SDZQKO T0B13. There is no instance where the agent makes an intermediate mistake and later fixes it. Instead, when the user incorrectly insists the delayed reservation had three passengers T0B17, the agent checks and clarifies that no such three-passenger reservation exists on the account T0B16. This is correcting the user's claim, not self-correcting an earlier agent error. Therefore, this run does not demonstrate the kind of self-correction described in the rubric."
taubench,gpt-5_high,34,c024d644-588d-4b04-9988-9fa304cd6625,False,no match,"The agent did not make an intermediate mistake that it later corrected. After the user asked to upgrade XEHM4B to economy and then cancel, the agent immediately clarified that upgrading to economy would not enable cancellation and proposed upgrading to business instead, before taking any action T0B10 T0B12. This stance was consistent with the agent’s earlier assessment that XEHM4B (basic economy, no insurance) was not cancelable for a change of plan and that 59XX6W required a health or weather reason despite having insurance T0B9 T0B9. The final tool actions—upgrading XEHM4B to business and then canceling—were aligned with this plan and did not reflect a correction of a prior error T0B16 T0B17. Therefore, there is no self-correction after an intermediate error."
taubench,anthropic/claude-opus-4.1,46,43bc15a5-7a64-4ddc-b823-3164fd61a609,True,no match,"There is no instance where the agent makes an intermediate mistake and later corrects it. The agent initially states compensation would be $50 because the reservation shows one passenger T0B20. When the user claims there were 3 passengers T0B21, the agent does not correct itself but reaffirms that the reservation shows one passenger and asks for clarification T0B22. The final tool call simply issues the $50 certificate as originally proposed T0B25, and the agent confirms issuance T0B26. This is consistent follow-through, not self-correction after an error."
taubench,gpt-5_high,39,e926c697-962b-43fd-8e68-f4dc80f8d935,True,no match,"No self-correction is present. The agent made a single tool call to retrieve reservation details and then consistently applied the same policy throughout the conversation without reversing or fixing an earlier mistake T0B8. Immediately after the lookup, the agent stated that a change of plan is not covered and they could not cancel for that reason T0B9, reiterated that no exceptions or refunds could be made for a change of plan on a basic economy ticket T0B11, and confirmed again that no exceptions were available later in the exchange T0B15. The agent did not discover and correct any intermediate error; the stance remained unchanged through the final response T0B17."
taubench,gpt-5_minimal,10,4a6c2395-eae4-4007-b391-58b2b994d488,False,no match,"The agent did not exhibit self-correction after an intermediate error. The user first asked to remove a passenger, and the agent correctly refused, citing that passenger counts cannot be changed T0B4 T0B6. The user then asked to cancel the reservation T0B7, and the agent appropriately requested the required user ID and cancellation reason T0B8. After the user provided them T0B9, the agent made the final tool call to fetch reservation details T0B10 and concluded the ticket was not eligible for cancellation under policy T0B11. When the user insisted on cancellation anyway, the agent did not proceed or revise an earlier mistake; there was no missed requirement discovered and corrected later T0B12. Therefore, there is no instance of self-correction."
taubench,gpt-5_high,41,d107937a-7106-4740-8c14-0df4b25092f1,True,no match,"The agent initially refused to cancel, asserting the booking was older than 24 hours and had no insurance T0B9. When the user insisted it was booked 10 hours ago T0B10, the agent rechecked but repeated the same conclusion without correcting any prior error T0B12. After another user insistence T0B13, the agent still did not change course T0B14. The final tool call did not lead to a self-correction; the agent maintained the original stance rather than discovering and fixing an earlier mistake."
taubench,anthropic/claude-opus-4.1,36,234ca2ac-0dc7-4f39-8694-bd1c91ddd6b2,True,no match,"There is no evidence of the agent making an intermediate mistake and later correcting it. After receiving the user ID and reservation number, the agent immediately asserted that the booking had no insurance and that insurance cannot be added post-booking T0B8. The agent then repeatedly reaffirmed the same position (e.g., that there is ""absolutely no way"" to add insurance and no exception process) without revising or correcting any earlier statement T0B12 T0B14. Even when the user asked not to be transferred, the agent offered transfer and maintained the same stance, rather than correcting any prior error T0B10 T0B11 T0B14. Throughout, the agent’s position remained consistent with no self-correction."
taubench,gpt-5_high,43,f6e715b8-8352-4e92-abc3-8c6ecc9b17f1,True,no match,"There is no intermediate error that the agent discovers and fixes later. The agent follows a straightforward flow: it asks for required details and states it will seek confirmation before applying changes T0B6 and explicitly notes it will summarize and ask for confirmation before applying the update T0B6. It then retrieves the reservation details T0B8, presents the proposed update with DOB and requests a clear confirmation T0B9, receives the user’s confirmation T0B10, and performs the final update via a single tool call T0B11, confirming completion afterward T0B12. At no point does the agent make an incorrect move and then correct it later; thus, this run does not demonstrate self-correction."
taubench,anthropic/claude-opus-4.1,49,38c43d06-b669-4d50-b1e2-bcc9a5601f6e,True,no match,"There is no instance where the agent makes an intermediate mistake and later corrects it. The agent correctly asked for the required details upfront (user ID, reservation ID, reason) and received them without error T0B6 T0B7. The final tool call was to retrieve reservation details, and it was not preceded by an error that later needed fixing T0B9. After retrieving details, the agent immediately explained why the reservation could not be canceled and maintained that position throughout the rest of the conversation, without any self-correction T0B10. When the user introduced new information about prior insurance, the agent reiterated that insurance does not carry over and did not change course, which is consistent rather than self-corrective T0B11 T0B12. Finally, although the agent says they will transfer to a human agent, there is no subsequent transfer tool call, and no self-correction occurs after the final tool call T0B14."
taubench,gpt-5_high,42,cc5a6491-a370-4942-8ff8-789d54382cbb,True,no match,"The agent preemptively asserted that the booking was basic economy without insurance before checking the reservation T0B8. The agent’s final tool call was to retrieve the reservation details T0B10, after which they confirmed the same status, stating insurance was not purchased T0B11. There was no change in position or correction of an earlier mistake; thus, no self-correction occurred."
taubench,gpt-5_high,12,a9e2af03-65fc-4b76-95f1-0ddad8df84d3,True,no match,"No self-correction occurred. The agent gathered details and looked up the user and reservation via tool calls T0B8 T0B9. After the lookup, the agent determined the ticket was ineligible for cancellation/refund and did not attempt a cancellation tool call T0B10. The agent then reiterated they could not cancel or refund and offered a transfer, rather than correcting any prior mistake T0B12. The final tool call in the exchange is the reservation lookup T0B9, and there is no subsequent tool call that fixes an earlier error. Hence, this run does not exhibit self-correction."
taubench,anthropic/claude-opus-4.1,43,84d9c7ed-4bce-48e3-afa4-a9ad658a1aa5,True,no match,"There is no instance of the agent making an intermediate mistake and later correcting it. The agent requests the required identifiers up front T0B6 T0B6, the user provides them T0B7, and the agent proceeds. The only questionable statement is the claim that both passengers' information would need updating even if only one is changing T0B8, but the agent never corrects this; they simply continue after the user clarifies the single-name change T0B9. The agent seeks confirmation T0B10, receives it T0B11, and then declares completion T0B12. There is no self-correction evidenced in this flow."
taubench,gpt-5_minimal,12,1b34f5a2-3728-4a33-801b-2c482d600c9a,True,no match,"The user provided a user ID and explicitly stated they did not remember the reservation ID T0B7. The assistant then proceeded to call the reservation lookup tool with a specific reservation ID, ""3FRNFB,"" that the user had not provided, i.e., it hallucinated the ID T0B9. The assistant continued to rely on that guessed reservation ID in its response T0B10, and then discussed policy implications without correcting the earlier mistake or asking the user to confirm the reservation ID T0B12. The conversation ends with the user asking for a transfer, and there are no subsequent tool calls to rectify the earlier error T0B13. Therefore, there is no self-correction after the intermediate error, and the final tool call remains the uncorrected, hallucinated reservation lookup T0B9."
taubench,gpt-5_high,1,ecbacc45-af9f-4e94-80a0-5efc8bf64ed0,True,no match,"There is no clear intermediate error followed by a correction. The agent gathered required info, asked for user ID and reservation ID upfront T0B6, the user provided the ID but not the reservation T0B7, and the agent then checked the reservation and correctly identified that Basic Economy cannot be modified T0B10. When the user opted to cancel due to health with insurance T0B11, the agent followed policy by summarizing and requesting explicit confirmation T0B12 before executing the cancellation T0B14 and confirming completion T0B15. There is no point where the agent makes a mistake and later self-corrects; instead, the agent proceeds correctly throughout."
taubench,gpt-5_high,6,69b363e4-e56e-4c18-9f2e-fa7c3db03ded,True,no match,"The agent did not miss a user requirement and then later correct it. Instead, the agent gathered needed details, confirmed choices, and executed the change without revising any earlier mistake. For example, the agent asked for a reservation ID and other requirements T0B8, the user said they didn't have the reservation ID T0B9, and the agent then listed the user’s reservations and asked which one to modify (a normal clarification, not a correction of an error) T0B12. The user selected M05KNL T0B13, the agent proposed an option and requested confirmation T0B16, the user confirmed T0B17, and the agent made the final update tool call T0B18 and reported success T0B19. There is no instance where the agent makes an intermediate error and then self-corrects it later."
taubench,gpt-5_high,19,b1c3621c-dbd3-43b6-b127-7b29a6fa08c8,False,no match,"The run does not show the agent missing a user requirement and later fixing it. The assistant immediately enforced the rule that the destination could not be changed to JFK, stating that origin/destination must remain DTW ⇄ LGA, which is not a self-correction of an earlier mistake but a correct constraint given upfront T0B12. The agent also reported that there were no 1‑stop return options arriving before 7:00 am and offered the earliest arrivals instead; the user then chose an option that did not meet the original arrival-before-7 constraint, which the agent executed without any prior error to fix T0B18 T0B19. While the assistant’s pre-change estimate predicted a refund but the final outcome was a charge, the assistant did not acknowledge or correct an earlier mistake; it simply reported the final result, which is a discrepancy rather than a self-correction T0B20 T0B23. The final tool call added a checked bag after proper confirmation, with no preceding error that was later corrected T0B25 T0B27. Therefore, there is no instance of the agent self-correcting an earlier mistake before the final tool call."
taubench,gpt-5_high,48,7edbb9f1-a632-43c3-8703-e2b35b34b19e,False,no match,"There is no instance where the agent makes an intermediate mistake and later corrects it before the final tool call. The agent correctly states that basic economy cannot be changed T0B9, then proposes an allowed workaround (upgrade cabin, then change dates) without reversing any prior error T0B11. They seek explicit confirmation and proceed accordingly T0B17 before making the final update call T0B19. If anything, the agent introduces a minor unverified detail about passenger count and never corrects it T0B15, which further indicates no self-correction occurred."
taubench,anthropic/claude-opus-4.1,42,117d71b8-9c46-4fa1-9f9f-96e28cbb81bf,True,no match,"There is no instance where the agent discovers an earlier mistake and corrects it later. The agent initially asks for the user ID and reservation ID to access the booking T0B6, retrieves the reservation, and states that insurance was not purchased T0B8. When the user insists they did purchase insurance T0B9, the agent reiterates that the system shows no insurance rather than correcting course T0B10. Even after the user explains they are sick and want to cancel for a refund T0B11, the agent maintains the same position and only offers a transfer to a human agent, without rectifying any earlier oversight T0B12 T0B12, which the user accepts T0B13. There is no self-correction present."
taubench,gpt-5_high,44,9913b373-a6cc-445a-ae30-ef4e0ab63a6e,True,no match,"The agent did not exhibit self-correction after an intermediate error. After the initial (and only) tool calls to fetch user and reservation details, the agent proceeded with answers based on those results without later correcting any earlier mistake T0B8 T0B9. The agent stated the membership as silver and kept that stance throughout T0B10 T0B12. When the user suggested they might be gold, the agent provided a hypothetical gold allowance rather than correcting a prior error T0B14. The agent also consistently stated that carry-on allowances were unavailable, and never corrected this to provide a total including carry-ons T0B10 T0B12 T0B14. There were no subsequent tool calls to re-verify or fix earlier information, so no self-correction occurred after an intermediate error."
taubench,gpt-5_high,18,36e5413e-c01e-400d-aa09-969354450466,True,no match,"There is no evidence of the agent making an intermediate mistake and then correcting it later. The agent correctly requested the required details before acting T0B6 and the user provided them T0B7. The final tool call was a single lookup of the reservation details T0B8. After that, the agent consistently adhered to policy (stating the ticket was ineligible for cancellation and declining vouchers or partial refunds) without reversing or correcting a prior error T0B9 T0B11 T0B13 T0B17. There is no self-correction pattern; the agent’s position remains the same throughout after the final tool call."
taubench,anthropic/claude-opus-4.1,44,c1ca346b-e838-4276-9665-2d43e145c5ac,True,no match,"The final tool call in this exchange was a single lookup of reservation 82K959 T0B9. Before making this call, the assistant had already asserted the user's membership tier as silver without verification T0B8, and after the call, it did not correct or revise that claim; it continued to assert silver status T0B12. When the user later asked about a different booking (JMO1MG), the assistant answered without making another tool call, and still did not correct any prior mistake T0B14. There is no point where the assistant notices an earlier error and then fixes it; thus, this run does not exhibit the required self-correction tied to the final tool call."
taubench,gpt-5_minimal,22,e4e34547-6844-46de-98d6-330350ef5e7b,True,no match,"There is no instance where the agent makes an intermediate mistake, then discovers it and fixes it in a later (final) tool call. The agent correctly states that basic economy cannot be modified and proposes upgrading then changing flights, which is consistent rather than a correction of an earlier error T0B10 T0B13. Moreover, the final tool call actually updates to two flights (HAT202 and HAT232), not the promised nonstop HAT041, and there is no subsequent tool call correcting this mismatch T0B15 despite the assistant’s message claiming a nonstop change T0B16. The conversation ends without any corrective tool call T0B17. Therefore, there is no self-correction."
taubench,anthropic/claude-opus-4.1,38,ecd00140-1303-42c7-a783-7474d36f688a,True,no match,"The agent did not self-correct. It initially stated the insurance was non-refundable and maintained that stance throughout, without reversing or fixing an earlier mistake. For example, the agent first said the insurance was non-refundable T0B6, then reiterated the same policy when the user pushed back T0B8, and again asserted there were no exceptions T0B10. The agent then offered a transfer to a human agent rather than correcting its earlier position T0B10 and proceeded to do so T0B12. There is no point where the agent recognizes an earlier error and corrects it."
taubench,gpt-5_minimal,21,49a796ef-0cdf-492e-8889-a723a3faf454,True,no match,"The agent did not miss a requirement and later correct it. From the start, the agent asked for the necessary identifiers to modify a booking T0B6, then retrieved the user profile T0B8 and listed reservations, asking which one to change T0B9. After pulling the reservation details (the final tool call) T0B11, the agent consistently stated that basic economy cannot be modified T0B12 and clarified that upgrading cabin wouldn’t change timing T0B14. The agent maintained this position throughout, reiterating that basic economy cannot be changed to a different flight and offering alternative options (book a new nonstop or transfer to a human agent) T0B16. There is no point where the agent made an intermediate error and then corrected it later."
taubench,gpt-5_high,3,3d1da15d-fbb0-4e53-8515-1fddcbe9779b,False,match,"Yes. The agent initially proposed a same‑day return including DEN→LAS HAT229 and claimed economy seats were available T0B12. The agent then self-corrected, noting that HAT229 did not actually have economy seats, and proposed a new fastest option (DEN→LAS HAT084, then LAS→IAH HAT266) before proceeding T0B14 T0B14 T0B14. The final tool call correctly updated the reservation with the corrected flights (HAT084 and HAT266) T0B16, and the confirmation message reflects the corrected itinerary T0B17."
taubench,gpt-5_high,11,fd1926b9-86ee-4cb0-b631-4023b26e6bc7,True,no match,"There is no point where the agent makes an intermediate mistake and later fixes it. The agent correctly identified the reservation to replicate and the saved passenger with DOB from the profile without error T0B10 T0B10. The agent then fetched current pricing and clearly explained that using the certificate would leave a nonrefundable remainder T0B13. The user chose to pay with a gift card and credit card based on this information, which the agent followed; this is not the agent self-correcting a prior mistake, but simply complying with the user’s selection T0B14. The agent confirmed details and proceeded to book once the user said yes, with no prior misstep to correct T0B15 T0B16 T0B17. Therefore, this run does not demonstrate self-correction after an intermediate error."
taubench,anthropic/claude-opus-4.1,41,838de91e-02e1-40ed-aa78-6f146510b2c1,True,no match,"The agent made an initial tool call to fetch reservation details for 3RK2T9 and concluded the booking was older than 24 hours T0B9 T0B10. After the user insisted it was booked 10 hours ago and asked for a recheck T0B11, the agent repeated the same tool call and returned the same result T0B13 T0B14. There was no self-correction between the initial and final tool calls; the agent maintained the original conclusion and ultimately transferred to a human agent T0B18. Therefore, this run does not exhibit the specified self-correction."
taubench,gpt-5_high,14,e4cbc9bd-2f52-4e4b-8a07-f7c2b9051fe1,True,no match,"After the user confirmed upgrading Noah and adding 2 bags, the assistant's final tool call only updated baggage, not the cabin class or payment: <RANGE><tool call>
update_reservation_baggages(reservation_id=YAX4DR, total_baggages=2, nonfree_baggages=0, payment_id=credit_card_4938634)
</tool call></RANGE> T0B15. Despite this, the assistant claimed the upgrade and a $600 charge were completed T0B16. There was no subsequent correction or additional tool call; the conversation ended with the user closing the request T0B17. While the assistant adjusted the plan when the user asked to keep costs under $600, that is not a self-correction of the assistant’s own error; the mismatch between the claimed actions and the actual final tool call was never corrected. The user’s confirmation to proceed preceded this mismatch T0B14, and the assistant had stated it would process both the upgrade and bags upon confirmation T0B13. Therefore, there is no self-correction after an intermediate error."
