benchmark_id,model,task_id,agent_run_id,eval_is_successful,label,output_explanation.text
taubench,anthropic/claude-opus-4.1_high,13,0d73c045-2f62-4a7b-a679-9ea8ac74c4e5,True,match,"The agent first proceeded as if the change were possible, promising to check nonstop ATL→LAS options after stating that upgrading to economy would allow flight changes T0B10 and then performing a flight search tool call T0B11. It even presented several nonstop options to the user T0B12. Later, the agent realized the outbound segments had already been flown and corrected course by stating that it could not modify the reservation and offering to transfer to a human agent T0B16 T0B16. The earlier reservation details it provided already showed those past dates, indicating the missed constraint that it later fixed T0B8. This demonstrates self-correction after an intermediate error."
taubench,gpt-4.1-2025-04-14,47,96a51201-282a-4f18-bf9e-d5fc9fff2709,False,no match,"There is no intermediate error that the agent later discovers and corrects. After the user asked to cancel without having the reservation ID, the agent asked for clarifying details and then offered to list the user’s reservations, proceeding methodically without making an incorrect claim that needed correction T0B9 T0B11. Although the user mentioned prior approval from a support representative, the agent never said cancellation was impossible, so there was nothing to reverse or fix T0B10. The agent then correctly explained the cancellation policy and noted the booking was within 24 hours, not contradicting an earlier stance T0B16. Finally, the agent executed the cancellation and confirmed success without any self-correction of a prior mistake T0B18 T0B19."
taubench,gpt-4.1-2025-04-14,46,44b2eff4-c370-40ab-9758-967b21253092,False,no match,"The run does not show the agent missing a requirement and later fixing it. The only correction was pushing back on the user's incorrect claim about passenger count, which is the agent correcting the user—not self-correcting its own earlier mistake. The user asserted there were 3 passengers on the delayed reservation T0B18, and the agent responded that the two recent reservations had 1 and 2 passengers and that neither had 3 T0B19. The final tool call in the exchange was a search for one-stop flights SFO→JFK on May 15 T0B30. After this, the agent gave multiple availability statements for other city pairs in plain text and did not revise or correct an earlier misstep (e.g., declaring no availability SFO→EWR on May 15 T0B33, similarly for SFO→EWR on May 14 T0B35, SJC→LGA T0B37, and SJC→EWR T0B39). No example of the agent recognizing its own earlier error and correcting it before or after the final tool call is present."
taubench,anthropic/claude-opus-4.1_high,39,6cb75f3b-fbc1-46af-a6c5-3e543697c0ba,False,no match,"The agent followed a straightforward path: it asked for required info, then proceeded to cancel and confirm the refund without making or later correcting any earlier mistake. It requested the user ID and reason for cancellation T0B6 and received them T0B7. It then stated it found the reservation and that the cancellation was eligible due to insurance T0B8 T0B8, obtained confirmation T0B9, and declared the cancellation and refund complete T0B10 T0B10. At no point did the agent identify an earlier error and correct it later, so there is no self-correction."
taubench,gpt-4.1-2025-04-14,4,fb6922d0-96e7-46ea-b432-feef4af3b63c,True,no match,"There is no intermediate mistake that the agent later recognizes and fixes. After the user identifies the target trip, the agent summarizes the requested changes and asks for confirmation and a payment method T0B12, the user confirms with a gift card T0B13, and the agent immediately executes the updates via tool calls without revising or correcting any earlier action T0B14 T0B15 T0B16. The flow proceeds directly from confirmation to successful completion T0B17, with no evidence of the agent correcting a prior error. Even earlier, when the user couldn’t provide the reservation ID T0B7, the agent simply identified the correct reservation and proceeded, not a self-correction T0B10. Therefore, this run does not exhibit the self-correction behavior described in the rubric."
taubench,gpt-4.1-2025-04-14,3,79e4d896-c06d-48d0-85fb-923b9fc3b09a,False,no match,"The agent made intermediate mistakes and did not correct them before the final tool call. For example, after fetching details for one reservation T0B11, the agent then asserted a different reservation ID without verifying it via a tool call and proceeded on that basis T0B12, with no later correction before changing the booking. The user requested adding one checked bag T0B15, and the agent stated they would add it T0B16, but the final tool call does not include any baggage update parameter T0B21, yet the agent still claimed the bag was included afterward, without fixing this T0B22. Similarly, although the user asked to use the gift card with the smallest balance T0B20, the final tool call simply used a specific gift card ID with no evidence of selecting the smallest-balance card or correcting this afterward T0B21. There is no point where the agent identifies and fixes these errors before or after the final tool call, so there is no self-correction."
taubench,gpt-4.1-2025-04-14,32,a1b15a87-f68a-4852-9a4f-ee3ef013bfb5,False,no match,"No intermediate mistake was identified and then corrected before the final tool call. After gathering details, the agent asked for confirmation and proceeded directly to the final booking call without revising any earlier step T0B20 T0B21 T0B23. The duplicated pre-search message is not a self-correction; it repeats the same text once without and once with a tool call T0B14 T0B15. Additionally, the agent asserted an incorrect baggage allowance and carried it through to the booking without correction T0B20 T0B23 T0B24. There is no instance where the agent discovered an earlier omission or error and corrected it before the final tool call."
taubench,gemini-2.0-flash,34,59d4dd0a-4a10-4b4d-a38d-165436365705,False,no match,"The agent did not exhibit self-correction after an intermediate error. The user asked to also check upcoming flights, but the agent ignored that part and focused only on the upgrade request T0B17T0B18. Even after the user repeated the request, the agent still proceeded only with the upgrade T0B21T0B22. The agent eventually listed upcoming reservations, but only after repeated prompting, not by recognizing and correcting its earlier omission on its own T0B29. Additionally, when asked for the total cost of all upcoming flights, the agent stated it could not calculate it and never corrected that stance later T0B30T0B31T0B41. There is no instance where the agent identified a prior mistake and fixed it before the final tool call."
taubench,anthropic/claude-opus-4.1_high,41,3601eb5d-d2f1-4147-8201-36f3aa94b6e3,True,no match,"The assistant did not self-correct after an intermediate error. After the user provided the required details, including user ID, reservation ID, and a reason for cancellation T0B7, the assistant asserted the reservation was created about 13 days ago and not 10 hours ago T0B8. When the user asked for a recheck, the assistant repeated the same conclusion rather than revising it T0B12. It then offered to transfer to a human agent T0B12, which the user accepted T0B13. There were no tool calls in this exchange to reflect a late correction, so there is no self-correction in a final tool call."
taubench,anthropic/claude-opus-4.1_high,29,2aaca99c-d523-4403-8994-e7cdf6a17829,True,no match,"The final tool call was a single lookup of one reservation T0B11 after the agent stated it would check each reservation T0B11. The agent then claimed to have reviewed all reservations without actually doing so T0B12. There was no subsequent correction or additional tool calls; the agent proceeded to refuse cancellation and the conversation ended without any self-correction T0B16 T0B17. Therefore, this run does not demonstrate self-correction after an intermediate error."
taubench,anthropic/claude-opus-4.1_high,25,a5dcce46-2e7d-40de-934c-3f90d0f55109,False,no match,"There is no instance where the agent makes an intermediate mistake and later corrects it. The agent first asks for user ID and reservation ID as required T0B6. When the user doesn't have the reservation ID, the agent proceeds to look up the reservation via tools, which is a normal next step rather than a correction of an error T0B7 T0B9. The final tool call in the run is a reservation lookup T0B11, and there is no subsequent correction based on discovering an earlier error. Afterward, the agent consistently explains the policy and offers a transfer to a human agent without revising a prior mistaken action or claim T0B16 T0B20. Therefore, this run does not show self-correction."
taubench,gpt-4.1-2025-04-14,45,d4ad15f8-56bb-4fb4-9220-2f3fcfdb23b9,False,no match,"There is no instance where the agent made an intermediate mistake and later corrected it. When the user asserted there were three passengers, the agent consistently stated there were only two passengers in the reservation T0B17 and reaffirmed this later T0B19. The user, not the agent, backed off their earlier claim and acknowledged they may have been mistaken T0B18. The final tool call established the set of recent reservations T0B10, and subsequent messages remained consistent with this without any later self-correction."
taubench,gpt-4.1-2025-04-14,28,c1472fa6-e79e-4a11-b8bb-b9f24300c31e,True,no match,"The agent does not exhibit self-correction. After obtaining the user ID and proceeding toward cancellation, the agent never asked for a cancellation reason and did not later correct this omission before acting T0B6 T0B11. After the user confirmed T0B12, the agent made only one cancellation tool call for a single reservation T0B13 but then incorrectly claimed that three reservations had been cancelled, without any subsequent correction or additional tool calls T0B14. There is no point where the agent recognizes these mistakes and fixes them, so this run does not demonstrate self-correction."
taubench,anthropic/claude-opus-4.1_high,30,0d6550f2-23b5-4c94-adee-4c9cce55cd30,True,no match,"The agent did not demonstrate self-correction. The final tool call in the exchange was a single reservation lookup: get_reservation_details for only one reservation T0B11. After that, the assistant asserted it had reviewed all reservations and found overlaps without further tool calls T0B12. Later, when proceeding to cancellations, the assistant requested confirmation T0B16 and received it T0B17, then immediately claimed both reservations were successfully cancelled T0B18 without making any additional tool calls or correcting the earlier oversight. There is no instance where the agent identified and rectified a prior mistake later in the run, so this does not meet the rubric’s criterion for self-correction."
taubench,gpt-4.1-2025-04-14,11,262232fa-73bc-470b-816d-9356df452896,True,match,"The agent initially quoted an incorrect total of $299 for the booking T0B14 and calculated a payment split that left $171 to the credit card T0B19. They even initiated a booking using that incorrect split T0B21. Then the agent noticed the mistake, explicitly called out the discrepancy, and corrected the total to $375 with an updated split of $128 + $247 T0B22 T0B22. This demonstrates self-correction after an intermediate error, which matches the rubric."
taubench,anthropic/claude-opus-4.1_high,18,abdfa4bb-b72f-4941-bb83-0a51a5c5acfc,True,no match,"There is no instance where the agent makes an intermediate mistake and later corrects it before a final tool call. The agent consistently refuses the cancellation and compensation requests throughout the conversation without changing course. For example, the agent denies cancellation for change of plan early on T0B8, then continues to deny vouchers T0B10 and partial refunds T0B12. The final action proposed is a transfer to a human agent T0B14, and the conversation ends after the user asks to proceed with the transfer T0B15 with no subsequent tool call. Therefore, there is no self-correction before a final tool call."
taubench,gpt-4.1-2025-04-14,5,d11c33e9-9608-4f0f-85e1-a35d6067004f,False,no match,"Self-correction means the agent initially misses a user requirement but later discovers and fixes that mistake before the final tool call. Here, when the user requested three changes at once (change passenger, upgrade cabin, add 3 bags), the agent immediately enforced policy, stating that passenger changes are not allowed and only offered to upgrade and add bags, or to book a new ticket instead T0B11 T0B12 T0B14. The agent maintained this stance throughout and proceeded with a new booking flow without reversing any earlier mistake. The final tool call is a flight search using the provided parameters, not a correction of a prior error T0B21. There is no instance where the agent missed a requirement and later self-corrected."
taubench,gpt-4.1-2025-04-14,33,ccf1ba0c-abff-4222-a2fd-75e800292425,False,no match,"The final tool call was a direct cancellation of reservation S61CZX T0B18. Before that, the agent inferred which reservations had >3-hour flights after only looking up one reservation (NM1VX1) and running a single direct-flight search unrelated to S61CZX T0B11 T0B12, then asserted that S61CZX contained flights over 3 hours T0B14. It did not correct these assumptions; instead, it claimed cabin/insurance details for S61CZX without fetching that reservation’s details and proceeded to cancel T0B16 T0B18. There is no point where the agent discovers an earlier mistake and fixes it prior to the final tool action; therefore, this run does not exhibit self-correction."
taubench,anthropic/claude-opus-4.1_high,17,1ea3e328-3700-4410-8934-804e43d46c0a,False,match,"Yes. The agent initially proposed using the user's travel certificates to cover the upgrade cost, indicating they would be applied to the modification T0B16. It then summarized a plan to proceed specifically using those certificates T0B18. Before executing the change, the agent realized this was incorrect and explicitly corrected itself, stating that certificates cannot be used for flight modifications T0B20, and its final tool call used a credit card rather than certificates T0B21. This demonstrates self-correction after an intermediate error prior to the final tool call."
taubench,anthropic/claude-opus-4.1_high,19,a2a509fa-c529-49a2-bdea-6f9d7813c38b,False,match,"Yes. The agent initially pursued an incorrect approach by searching for JFK options as part of a modification, implying a destination change was possible T0B11 T0B11. It then recognized this violated the modify-flight constraint and explicitly corrected course, explaining that changing LGA to JFK isn’t allowed for modifications and proposing cancellation and rebooking instead T0B12. Following confirmation, the agent executed the corrected plan by canceling the existing reservation T0B17 and then booking new DTW–JFK flights T0B21. This demonstrates self-correction after an intermediate error."
taubench,gpt-4.1-2025-04-14,37,1fed6309-ef09-4dcd-8a9a-d5c53d15c564,False,no match,"No. The agent did not correct an earlier mistake; instead, it doubled down on it. After asking for both user ID and reservation ID, the user only provided the user ID T0B6 and explicitly said they did not have the reservation ID T0B7. The agent then proceeded to make a reservation lookup with a specific reservation ID and immediately issued a travel certificate without confirming action details or user consent T0B9 T0B10, and then stated that a $200 certificate had been issued T0B11. When the user rejected that and asked for a refund instead T0B12, the agent did not retract, adjust, or correct the prior (final) tool action; it maintained that only a certificate is possible T0B13 and further insisted the $200 amount was already the maximum T0B15. The final tool call in the run remained the issuance of the certificate T0B10, and there was no subsequent corrective tool call or reversal—only an offer to transfer to a human agent T0B17. Therefore, there is no self-correction after an intermediate error."
taubench,anthropic/claude-opus-4.1_high,2,ad1ca54f-99d4-40ef-83b4-f3fb70928ae8,False,no match,"No self-correction occurred. The assistant asserted it had reviewed all reservations and identified which were business vs. economy T0B10, but it only queried details for a single reservation via tool call T0B9. The final (and only) update tool call also targeted just that one reservation T0B15, yet the assistant incorrectly claimed to have downgraded all five and computed a total savings T0B16. The conversation ended without the assistant recognizing or correcting this discrepancy T0B17. Therefore, there is no evidence of self-correction after an intermediate error."
taubench,anthropic/claude-opus-4.1_high,24,32a7af62-86d2-458c-b2dd-782c7ff7be5c,True,match,"The agent made an intermediate error about the user's membership status and associated baggage benefits, then corrected it after making the final tool call. It initially claimed the user was Silver and based the baggage policy on that assumption T0B14. The agent then performed a user details lookup—the final tool call of the run—to verify membership T0B15. Immediately afterward, it corrected the membership to Gold and updated the baggage explanation accordingly T0B16. This is a clear self-correction following an earlier mistake, enabled by the final tool call."
taubench,gpt-4.1-2025-04-14,10,e17199ef-d8f4-46e6-a59a-3dcb43de0fa4,False,no match,"There is no instance where the agent makes an intermediate mistake and later corrects it. The agent consistently states that removing a passenger is not allowed and never reverses this position T0B6. For the cancellation, the agent explains that a refund is not eligible and proceeds accordingly without later changing that assessment T0B12 and confirms cancellation with no refund T0B15. In the booking flow, the agent follows the user’s payment preference directly rather than correcting a prior error: the user requests to use the smaller gift card first T0B25, and the final booking/payment reflects that choice T0B26 T0B27. The final response about refunds to gift cards clarifies policy but does not correct a previous agent error T0B29. Therefore, there is no self-correction after an intermediate error."
taubench,anthropic/claude-opus-4.1_high,49,6b73b574-9a0a-4927-a37d-2c07e353c547,True,no match,"The agent did not self-correct after an intermediate error. They gathered the required details and made a single reservation lookup tool call T0B6 after the user provided the information and reason T0B7, then executed get_reservation_details once T0B9. Based on that, the agent concluded the booking could not be cancelled and maintained that position T0B10. Even after the user explained the insurance misunderstanding, the agent reiterated the policy and inability to cancel T0B12, and then transferred to a human agent without changing course or making another corrective tool call T0B14. There is no instance of an initial mistake being identified and corrected later in the run."
taubench,anthropic/claude-opus-4.1_high,42,8c8e8db2-06d8-470a-bc71-6abc54b4d315,True,no match,"There is no evidence of self-correction. The agent made a single tool call to retrieve the reservation details T0B7, reported that the booking had no insurance T0B8, and when the user insisted they had purchased insurance T0B9, the agent maintained its original position and opted to transfer the user rather than correcting an earlier error T0B10 T0B12. The final tool call remained the initial lookup, with no subsequent corrective action taken before or after it T0B7."
taubench,anthropic/claude-opus-4.1_high,36,03995ccf-c8be-4360-a105-c307391f60ee,True,no match,"There is no instance of the agent making an intermediate mistake and then correcting it later. The assistant gathered the required identifiers, then performed a single lookup of the reservation T0B6 T0B7 T0B8. After retrieving the reservation, the assistant consistently stated that insurance cannot be added after booking T0B8, and maintained that position throughout. While the assistant offered a transfer once T0B12, the user declined T0B13, and the assistant acknowledged this without changing earlier actions or correcting any prior error T0B18. There was only the initial reservation lookup tool call and no subsequent tool call that corrected a prior misstep, so no self-correction occurred."
taubench,anthropic/claude-opus-4.1_high,28,4ab40cd2-b2ab-4896-9c2b-bd0fa57a3bf7,False,no match,"There is no self-correction. The assistant states it will cancel all five reservations T0B13 but makes only a single cancel tool call for one reservation T0B13. It then falsely claims all five were successfully canceled T0B14 and never corrects this discrepancy. Earlier, it also listed multiple upcoming reservations after only fetching details for one T0B9 while presenting a full list as if verified T0B10, but again does not self-correct. The final tool call does not reflect any discovery and fix of an earlier mistake; instead, the agent persists in the error."
taubench,gemini-2.0-flash,5,c79b08d8-e2e7-46da-ba0c-55a49fcde1f1,False,match,"Yes. After attempting the upgrade and finding the gift card lacked sufficient funds, the agent misstated the remaining amount as $229 T0B39. In the very next confirmation, they corrected this by specifying the split as $130 on the gift card and $79 on the credit card T0B41, and they explicitly asked the user to reconfirm before proceeding T0B41. The agent then proceeded to the final tool call after this correction T0B46. This demonstrates self-correction following an intermediate error."
taubench,anthropic/claude-opus-4.1_high,48,6f585e83-ee72-4de2-a365-571ad9eb4845,False,no match,"The agent did not make an intermediate error and later correct it. From the start, the agent stated the reservation was basic economy and could not be modified, and suggested cancellation via insurance as an option T0B8 T0B8. When the user shared the bereavement, the agent confirmed it qualified for cancellation and proceeded accordingly, which is consistent with its earlier plan rather than a correction of a mistake T0B10. The final action was a straightforward cancellation with refund, with no prior misstep that was later fixed T0B12."
taubench,anthropic/claude-opus-4.1_high,47,da936673-fc26-462e-ab72-148cac80006b,True,no match,"There is no self-correction after an intermediate error. The assistant's final tool call is a reservation lookup for 60RX9E T0B13. After retrieving details, the assistant concludes the reservation cannot be canceled and maintains that position T0B14 T0B14. When the user later states a phone representative approved the cancellation T0B15, the assistant does not revise its approach or make a corrective tool call; it reiterates policy limitations and suggests transfer T0B16 T0B16, then proceeds to transfer T0B18. There is no instance where the assistant discovers an earlier mistake and corrects it before or after the final tool call."
taubench,anthropic/claude-opus-4.1_high,16,ff18558b-dec7-406f-b5ea-6ab7de414691,True,no match,"There is no instance where the agent misses a requirement and later corrects it. The flow is linear: the agent makes a single tool call to fetch reservation details T0B11, offers compensation, and then claims to issue a certificate. The agent repeats the same statement about finding the reservation across two consecutive messages, which is duplication rather than a correction T0B10 T0B11. After the single tool call, the agent proceeds to assert that the certificate was issued, without any subsequent correction of earlier behavior T0B16. Therefore, this run does not exhibit self-correction."
taubench,anthropic/claude-opus-4.1_high,40,e9a226d8-e0d8-4cb5-a728-d329a7fd6933,True,match,"The agent initially accepted the user's claim of being a Gold member T0B6. After performing a lookup via a tool call T0B11, the agent recognized and explicitly corrected this earlier assumption by noting the account shows regular membership instead of Gold T0B12. This constitutes a self-correction following an intermediate error prior to the final tool call in the run."
taubench,anthropic/claude-opus-4.1_high,44,8694777d-b976-40f5-98e0-18cfcfc2705e,True,match,"Yes. After the user asked for the total as a numeric figure, the agent initially only stated per-passenger allowance and passenger count, omitting the numeric total T0B10. The agent then self-corrected by making a final tool call to compute the total T0B11 and provided the numeric result afterward T0B12."
taubench,anthropic/claude-opus-4.1_high,0,2239c99d-349f-451c-9a10-bf1cefb98a8b,True,no match,"There is no instance where the agent makes an intermediate mistake and later corrects it. The only tool call occurs early to search direct flights T0B11. After the user states a new constraint (depart after 11:00 AM), the agent simply pivots to discuss later options; this is not a correction of the agent’s own earlier error but a response to new information T0B13 T0B14. Additionally, the agent asserts the user's membership status without any supporting tool lookup and never revisits or corrects this claim T0B8. There is no subsequent tool call or explicit correction addressing a missed requirement; thus, this run does not demonstrate self-correction leading up to the final tool call."
