benchmark_id,model,task_id,agent_run_id,eval_is_successful,label,output_explanation.text
taubench,o3-2025-04-16,43,652bb699-e63f-45b5-8b43-c4f88d45b74d,True,no match,"The agent followed a straightforward, linear process without making and then correcting an intermediate mistake. It asked for the necessary identifiers first T0B6, received them from the user T0B7, retrieved the reservation details via a tool call T0B8, and then requested the specific passenger change details T0B9. The user provided the requested change T0B10, the agent summarized and asked for explicit confirmation T0B11, received confirmation T0B12, and executed the final update tool call T0B13, confirming success afterward T0B14. There is no point in the run where the agent missed a requirement and later corrected it; all steps were consistent and direct."
taubench,o3-2025-04-16,41,51ff304f-5f09-4108-8376-15c7fdf1a536,True,no match,"The agent made only one tool call to fetch the reservation details and then stuck with its initial conclusion without correcting itself later T0B8. After that call, it asserted the booking was created more than 24 hours ago T0B9. When the user insisted the booking was made only 10 hours prior T0B10, the agent did not self-correct; it reiterated the same timestamp and asked for confirmation of the code instead of performing a new check or updating its approach T0B11. There were no further tool calls after the user’s correction request (the final tool call remained the initial lookup) T0B8. Therefore, this run does not exhibit self-correction."
taubench,o3-2025-04-16,21,f037821b-cb2d-41c9-b919-55b6f52dfca7,False,no match,"There is no intermediate mistake that the agent later discovers and corrects. The agent correctly identified from the start that the existing reservation was Basic Economy and could not be modified, and maintained that policy consistently throughout the conversation T0B10 T0B12. When the user introduced a $100 budget, the agent immediately respected it by explaining Economy options exceeded the limit and offering Basic Economy alternatives within budget, which is not a correction of a prior error but a straightforward response to the new constraint T0B13 T0B17. The final tool call simply books the selected Basic Economy flight per the user’s confirmation, with no evidence of self-correcting a prior mistake T0B19 T0B20 T0B21."
taubench,o3-2025-04-16,35,9f646a89-8ab1-4de7-9d9d-c7ea89190967,True,no match,"The assistant did not demonstrate self-correction. It initially asserted the ticket was Basic Economy, booked over 24 hours ago, and without insurance, concluding it could not be canceled or refunded T0B8. It then maintained this position, proposing a transfer rather than revising its earlier conclusion T0B10, even after the user insisted on not being transferred T0B11. The assistant continued to deny a date change due to Basic Economy restrictions T0B12 and refused adding insurance post-booking T0B14. There is no point where it corrects an earlier mistake; the stance remains consistent throughout, so this run does not exhibit self-correction."
taubench,o3-2025-04-16,18,568efef0-f14c-4dc5-8724-29272155816d,True,no match,"The agent made only one tool call to fetch reservation details and never changed course afterward T0B8. Prior to that, the agent simply gathered required information, which is not an error to self-correct T0B6. After the tool call, the agent consistently refused the cancellation and any compensation and did not correct an earlier mistake or update their approach: they denied cancellation due to policy T0B9, refused a voucher T0B11, refused a partial refund even after “double-checking” T0B13, and again refused a partial refund T0B15. There is no instance where the agent recognized an earlier error and corrected it before the final tool call or thereafter. Hence, no self-correction occurred."
taubench,o4-mini-2025-04-16_high,17,bfc206e3-53cf-482a-b770-afa9819ed036,True,no match,"There is no instance where the agent missed a requirement and later corrected it before or during the final tool call. The final tool call in the exchange is the one-stop flight search for May 24 T0B11. After that, the agent even suggested an option that conflicts with stated constraints (upgrading only one passenger), and did not correct this later T0B20. Subsequent messages only ask for the reservation code and do not include any correction or additional tool calls T0B24 T0B26. Therefore, this run does not exhibit the self-correction behavior described in the rubric."
taubench,o3-2025-04-16,31,d731fd1f-af44-46c6-a0e1-48f324185c25,False,no match,"The assistant did not demonstrate self-correction. It initially asked for the reservation ID as a required piece of information T0B6, and the user explicitly stated they did not have it and gave the reason for cancellation T0B7. Despite this, the assistant proceeded to call a reservation lookup with a specific reservation ID that was never provided by the user T0B9, then referred to a different reservation ID for the ATL → JFK trip without acknowledging or correcting the inconsistency T0B10. Later, it provided yet another reservation ID for the other May 17 trip rather than correcting the earlier mismatch T0B14. At no point did the assistant recognize and fix these errors; it continued with inconsistent IDs, so there is no instance of self-correction."
taubench,o3-2025-04-16,9,48f9448f-9ad3-4731-88f4-86d8e195667e,False,match,"The agent initially misallocated payment by attempting to use $696 from a gift card that only had $129 balance, both in the proposed allocation and in the booking tool call T0B21 T0B9 T0B23. The agent then recognized this error and self-corrected in the final tool call by explicitly noting the limited balance and adjusting the amounts to use $198 + $129 from gift cards and $1,286 on the Mastercard T0B24. The subsequent confirmation reflects the corrected allocation (Gift Card 6136092 $129; Mastercard $1,286), demonstrating self-correction after the intermediate mistake T0B25 T0B25."
taubench,o3-2025-04-16,17,c24c0361-5e6a-47f3-b847-ab1c065174a8,True,no match,"No self-correction is evident. The agent’s final tool call was a price calculation, not a corrective action after an earlier mistake T0B12. After presenting a change proposal with an added cost of $2,010 T0B13, the user asked about an alternative (upgrade-only) if the outbound change wasn’t possible T0B14. The agent then provided a new (upgrade-only) option with a $1,758 difference, but this was a different option rather than a correction of an earlier error T0B15 T0B15. The conversation ended with no changes applied and no further tool calls to fix any prior misstep T0B19."
taubench,o4-mini-2025-04-16_high,1,05923d9e-ae56-4bd0-9b72-e6723bd7bd59,True,no match,"The agent does not exhibit self-correction after an intermediate error. After asking for both user ID and reservation ID, the user could not provide the reservation ID, and the agent proceeded by retrieving details and stating that the Basic Economy ticket cannot be changed, offering alternatives T0B6 T0B10. When the user asked about canceling via travel insurance, the agent confirmed insurance applicability, requested confirmation, and then canceled the reservation as asked T0B11 T0B12 T0B13 T0B14. At no point does the agent identify a prior mistake or missed requirement and correct it later; the flow is linear without revisiting or fixing an earlier error."
taubench,gpt-5_minimal,23,255bfcc5-8777-4b37-aaff-0a0b255b8377,False,no match,"The agent did not self-correct an earlier mistake; it updated the plan in response to new user requests. Initially, the agent proposed changing only the outgoing flight and keeping the return unchanged, which aligned with what the user had asked up to that point T0B10. The user then added a new requirement to move the return by one day T0B11, the agent clarified timing T0B12 and updated the proposal accordingly T0B14. Later, the user asked to upgrade to business and add two bags T0B15, and the agent reflected that change in its proposal T0B17 T0B17. When the user requested mixed cabins, the agent correctly stated that cabins must match and offered valid options, which is correcting the user's assumption, not an earlier agent error T0B22 T0B23. The final tool calls implement the confirmed Option A and add bags, without reversing or fixing a prior mistaken action T0B27 T0B28. Therefore, there is no instance of the agent recognizing and correcting its own earlier error."
taubench,o4-mini-2025-04-16_high,13,dc3d81bf-7100-47ae-ad9e-63b02fe9af2a,True,no match,"The final tool call was a search for one-stop availability from LAX to ORD on May 13 T0B22. This was not a self-correction of an earlier mistake; it followed an inability to upgrade due to no Economy seats on the first segment T0B20. The agent did not miss a requirement earlier and later fix it; instead, they attempted an upgrade, then searched alternatives, and the user ultimately asked for a transfer T0B30. There is no instance where the agent acknowledges an earlier error and corrects it before the final tool call."
taubench,o4-mini-2025-04-16_high,0,f28f15ef-dc1b-4092-8f0b-169c3eb9db5d,True,match,"The agent initially missed the user's departure-time constraint by proposing direct flights leaving at 06:00 and 01:00, which are before 11 AM T0B12 T0B12. After the user reiterated the requirement to depart after 11 AM T0B13, the agent corrected course by searching and offering one‑stop options departing at 19:00 and 22:00 T0B15 T0B15. The final tool call then booked that corrected itinerary (HAT136 and HAT039 on 2024‑05‑20) T0B19. This demonstrates self-correction prior to the final action."
taubench,o3-2025-04-16,13,fc9bcb69-fe31-4b93-92d7-36718ce44c97,False,no match,"There is no instance where the agent makes an intermediate mistake based on the user’s requirements and then later corrects it. After the user asked to change ATL→DFW to ATL→LAS, the agent briefly searched direct ATL→LAS flights T0B11, but immediately explained that such a change isn’t allowed for a Basic Economy reservation and due to the origin/destination restriction T0B12 T0B12. This is a correct application of policy, not a correction of an earlier error. The user then asked for separate booking options T0B13, the agent provided options T0B14, gathered details and sought confirmation T0B17, then made the final booking tool call T0B19 and confirmed success T0B20. No self-correction of an earlier misstep occurred."
taubench,o4-mini-2025-04-16_high,2,74bffd01-d7d5-4ca9-a15d-b6cbbad40e41,False,no match,"The agent did not demonstrate self-correction. It claimed to have found five business-class reservations and proposed downgrading all five T0B10. After the user confirmed, the agent executed a single tool call to downgrade only one reservation (JG7FMM) T0B12, but then incorrectly stated that all five reservations had been downgraded T0B13. It further asserted a total savings amount without performing additional corrective actions or tool calls T0B15. There is no point where the agent recognizes these inconsistencies and corrects them prior to the final tool call. Therefore, this run does not exhibit the required self-correction behavior."
taubench,o4-mini-2025-04-16_low,10,0fdd6199-f2b7-4237-8331-38df2e0863ca,False,no match,"There is no evidence of the agent making an intermediate mistake and later correcting it. The transcript shows a single user request to remove a passenger from a reservation T0B4, followed by a policy/examples block rather than continued agent actions. No tool calls or corrective actions occur in this run T0B5. Therefore, there is no self-correction."
taubench,o4-mini-2025-04-16_high,39,ec72808d-6850-4f44-a71b-557f5775fce9,True,no match,"There is no evidence of the agent making an intermediate mistake and later correcting it. The agent correctly asked for the required identifiers and reason up front T0B6, the user provided all three items T0B7, and the final action was a straightforward reservation lookup tool call T0B8. There is no missed requirement followed by a self-correction in this exchange."
taubench,o3-2025-04-16,47,4e286eae-124f-4527-8889-0c97d7e7361d,False,no match,"There is no instance of the agent making an intermediate mistake and later correcting it. The agent correctly gathered requirements up front T0B6, then listed the user's active reservations and explicitly asked which one to cancel and for the reason T0B10. After the user specified the reservation, the agent confirmed eligibility and sought explicit confirmation, without any prior denial or error to correct T0B12. The final tool call cleanly executed the cancellation T0B14 and the agent confirmed success T0B15. No self-correction behavior is present."
taubench,o3-2025-04-16,10,28766de4-f5d7-49ae-ac3f-e1d9dd439dae,True,no match,"The final tool call books a direct round trip in basic economy from JFK to SEA, uses the smaller gift card first, sets no insurance, and includes the free bag, satisfying the user’s requirements T0B22. However, there is no clear instance where the agent first missed a requirement and later corrected it. The only apparent misstep was making a one-stop search despite the direct-flight request, but the agent never acknowledged or corrected this; they simply proceeded with a direct option and booking, which is not a self-correction of an earlier error T0B14 T0B16. The final compliance with payment order was directly requested by the user and executed without any earlier mistake to fix T0B21 T0B22."
taubench,gpt-5_minimal,3,65e30c16-79df-4185-8629-4133a34d42f2,True,match,"The agent first attempted to process the change using the gift card it inferred as the smallest-balance option, explicitly invoking a tool call with payment_id=gift_card_7480005 T0B14. It then recognized this was insufficient and stated the card didn’t have enough funds, asking the user to choose another payment method T0B15. After the user selected a different gift card T0B16, the agent proceeded and confirmed the reservation update T0B17. This demonstrates self-correction after an intermediate error (insufficient funds on the initially chosen gift card)."
taubench,o3-2025-04-16,7,d63310fd-6a61-4bb0-b870-c9e103e1acae,True,no match,"There is no instance where the agent makes an intermediate mistake, discovers it, and then corrects it before the final tool call. The flow is linear: the agent asks for user and reservation IDs T0B6, looks up the user by ID when the reservation ID isn’t available T0B8, presents the reservations T0B9, retrieves the chosen reservation T0B11, searches for next-day ATL→PHL options T0B14 T0B15, proposes a specific ATL→LGA→PHL itinerary and asks for confirmation T0B16 T0B16, receives confirmation T0B17, and executes the update in the final tool call T0B18. At no point does the agent identify an error in its prior steps and correct it. Even when searching for alternatives, the agent limits the destination to PHL throughout T0B14 T0B15 and does not revise this to include EWR later. Therefore, there is no self-correction behavior in this run."
taubench,o3-2025-04-16,23,7fe5a883-50d7-488d-b67a-4bed52811a8d,False,no match,"The agent did not miss a user requirement and then later fix it. The flow was consistent: the agent collected IDs, offered options, confirmed details, and then executed the confirmed changes without revising an earlier mistake. They asked for the necessary identifiers up front T0B6, addressed the user’s requested change to a next-day nonstop outbound and one-day-later return T0B10, provided options and pricing differences T0B12, handled the user’s request for a business upgrade and two bags T0B13, clarified that insurance doesn’t waive fare differences (which was consistent with their earlier pricing, not a correction) T0B16, then summarized and sought explicit confirmation before making changes T0B21 and received it T0B22. The final tool calls executed the confirmed plan T0B23 T0B24 and the closing message reflects that outcome T0B25. There is no instance where the agent recognized and corrected an earlier misstep."
taubench,o3-2025-04-16,25,8e3a87fc-ba39-48b9-b9bc-a3960c0faf68,False,no match,"The agent does not demonstrate self-correction. They initially refuse the cancellation and keep the same position even after multiple user prompts invoking Silver status, without revising their earlier stance or correcting any mistake T0B10 T0B11 T0B12 T0B13 T0B14 T0B15 T0B16. In the booking phase, they also fail to correct a payment mismatch: the user requests charging the card ending in 7334 T0B23, but the tool call uses a different saved payment ID T0B24, and the agent nonetheless claims the 7334 card was charged without fixing this inconsistency T0B25. There is no point where the agent recognizes and corrects an earlier error before or in the final tool call T0B24."
taubench,o4-mini-2025-04-16_high,31,1402e3eb-a687-4205-b8b6-20ea0e5bbf83,False,no match,"The agent asked for both the user ID and the reservation ID for the ATL→JFK flight T0B6. The user explicitly stated they did not remember the reservation ID T0B7. The agent then correctly fetched user details T0B8 but immediately proceeded to call reservation details using a specific reservation ID that was never provided by the user T0B9. There is no subsequent correction of this mistake before the final tool call, so the run does not exhibit self-correction."
taubench,o3-2025-04-16,5,a1edb030-25aa-48de-934f-3ef1f63cd38d,False,match,"The agent first planned to change the passenger on the reservation, explicitly listing a passenger swap from Ivan Garcia to Omar Rossi as part of the requested changes T0B12 and reiterated this in the confirmation items T0B12. Later, before executing any changes, the agent recognized this was not allowed and corrected itself, stating that a passenger name cannot be changed to a different person and offering alternatives instead T0B16. The final actions taken reflect this correction: the agent only upgraded the cabin and added bags, without altering the passenger, as shown in the final tool call to update baggages T0B21 (paired with the prior cabin upgrade tool call T0B20). This is a clear instance of self-correction after an intermediate error, consistent with the rubric."
taubench,o3-2025-04-16,15,8ee4d19a-fc30-4c04-8c4d-5b52d27d81a6,False,no match,"There is no instance where the agent makes an intermediate mistake and then corrects it before the final tool call. The final tool call updates the reservation and issues a refund to a gift card T0B15, and the agent confirms the refund went to that gift card afterward T0B16. When the user objects and asks for the refund to go to the original payment method, the agent does not change anything or correct a prior error; instead, the agent asserts the gift card was the original method and leaves it as-is T0B17 T0B18. Additionally, the agent referenced and acted on reservation GV1N64 details before the user provided the ID, and never corrected this behavior later T0B13 T0B14. Therefore, there is no self-correction of a missed requirement prior to the final tool call."
taubench,o3-2025-04-16,8,862e318c-973d-4006-9b79-ada20b38b90d,False,match,"Yes. The agent made intermediate mistakes and then corrected them later. First, they attempted to book business class for three passengers while allocating only $871 total (the per-itinerary amount) across payment methods, implicitly treating the fare as a total rather than per passenger T0B21 and with three passengers included T0B21. They then realized the error and explicitly corrected it, noting the fare applies per passenger and updating the total to $2,613 T0B22. Later, they also corrected a miscalculation for the economy rebooking, changing the earlier total of $1,173 T0B26 after acknowledging the mistake and updating the total to $1,512 T0B28 T0B28. These instances show self-correction after intermediate errors."
taubench,gpt-5_high,5,be13efa3-ecea-454d-bcb1-3e9195148714,False,no match,"The user asked for three modifications (add 3 bags, upgrade to economy, change the passenger, with gift card payment) T0B7. The agent attempted the cabin upgrade via a tool call T0B12, then acknowledged that the cabin still hadn’t changed despite a charge and proposed retrying the upgrade T0B13 T0B13. The user approved proceeding T0B14, but the agent then only updated the passenger and added bags in subsequent tool calls T0B15 T0B16. The final state confirms the cabin remained basic economy T0B17. Because the earlier error (failed upgrade) was not corrected by the final tool call, this run does not exhibit self-correction."
taubench,o4-mini-2025-04-16_high,33,81198a94-216d-4bf4-b675-5b18c5c6404a,True,no match,"There is no instance where the agent makes an intermediate mistake and later corrects it. The final tool call only upgrades one reservation (NM1VX1) to business class T0B22, yet the agent claims all three reservations were upgraded, without any subsequent correction T0B23. Earlier, the agent correctly stated a policy limitation about canceling segments, which is not an error requiring correction T0B11. Overall, there is no self-correction; instead, the agent introduces an inconsistency and never fixes it."
taubench,o4-mini-2025-04-16_high,38,eb94f003-9f31-44cb-a2af-2a2ec1545182,True,no match,"The user asked to refund only the insurance without canceling the flight T0B4. The assistant immediately stated that the insurance could not be refunded or removed separately T0B6, and maintained this position when asked again T0B8 and when asked for an exception T0B10. When the user requested escalation, the assistant offered a transfer to a supervisor T0B11 T0B12. There is no point where the assistant recognizes an earlier mistake and corrects it; the stance remains unchanged throughout, so there is no self-correction."
taubench,o4-mini-2025-04-16_high,36,0bb554a0-207e-44f2-9551-fd814d94abf8,True,no match,"The assistant made a single lookup tool call and never corrected any earlier mistake afterward. It first asked for the user ID and reservation ID T0B6, received them T0B7, and performed one tool call to get reservation details T0B8. After that, it consistently maintained that insurance could not be added and offered a transfer, without making any subsequent tool calls that would indicate a self-correction T0B11 T0B13 T0B15. There is no intermediate error followed by a correction; the final (and only) tool call was not revised or superseded."
taubench,gpt-5_minimal,33,15e80e31-d112-401d-8256-64bc2000fe99,False,no match,"The final tool call performs a straightforward cabin upgrade on reservation S61CZX and does not correct any earlier mistake or missed requirement T0B20. Earlier, the assistant stated they couldn’t determine flight durations with their tools, which is not an error later corrected T0B14. The assistant also correctly refused a cancellation due to policy rather than fixing a prior mistake T0B16. After obtaining confirmation and a payment method for the upgrade T0B18 and the user’s explicit consent T0B19, the assistant executed the upgrade without any intervening self-correction T0B20. Moreover, later the assistant even declares a separate upgrade complete without a tool call, which is an uncorrected error, not a self-correction T0B29. Therefore, there is no instance of the agent missing a requirement and subsequently fixing it before the final tool call."
taubench,o4-mini-2025-04-16_high,25,53f28522-618f-4d8a-bc2e-1a09600cc4b4,False,no match,"There is no point where the agent recognizes an earlier mistake and explicitly corrects it later. The agent consistently denies the cancellation based on policy and maintains that position after the user appeals to Silver status, which is not a self-correction but a reinforcement of the same policy stance T0B10 T0B12. For the booking, the agent gathers missing passenger details, which is normal information collection rather than correcting an earlier error T0B16. The agent then proposes a specific flight and books exactly that after confirmation, without revising or correcting any previous misstep T0B19 T0B21. Therefore, this run does not exhibit the self-correction behavior described in the rubric."
taubench,o3-2025-04-16,40,022a239e-4cf9-4895-ac41-822467027e78,False,no match,"The agent did not self-correct via a later tool call. After asking for both user ID and reservation ID T0B6 T0B6, the user provided only the user ID and said they did not have the reservation ID T0B7. The agent then called get_user_details T0B8 and prematurely fetched reservation details for NM1VX1 T0B9. Later, the agent asked which reservation was affected and listed options, including WUNA5K T0B10, and the user specified WUNA5K as the canceled trip T0B11. However, there was no follow-up tool call to fetch WUNA5K; the final tool call remained the earlier NM1VX1 lookup T0B9. Therefore, the agent did not demonstrate self-correction in the final tool call."
taubench,o4-mini-2025-04-16_high,12,9a3112e9-1bf2-4d2d-a8d3-fbfb49b47232,True,no match,"The agent made an intermediate error by querying a reservation ID that the user did not provide and had explicitly said they didn’t have. The agent asked for the reservation ID as required T0B6, the user provided their user ID and explicitly stated they did not have the reservation ID T0B7. After correctly fetching user details T0B8, the agent then called get_reservation_details with a specific ID it introduced on its own T0B9. It then concluded the ticket could not be canceled T0B10 and doubled down when pressed T0B12. There was no subsequent correction of this mistake; the final tool call in the run is the erroneous reservation lookup, and the agent did not rectify the earlier error afterward. Therefore, this run does not exhibit self-correction."
