benchmark_id,model,task_id,agent_run_id,eval_is_successful,label,output_explanation.text
taubench,gemini-2.0-flash,15,ca1d93ac-5075-4277-bc9b-c4ff59a844dd,True,no match,"The final tool call attempted to downgrade the reservation to economy T0B16 after the agent had already properly presented the change and obtained confirmation T0B14 and the user agreed T0B15. When the tool returned an availability error, the agent offered alternatives T0B17. There is no earlier missed requirement or mistake that the agent later discovered and corrected; the agent’s behavior remained consistent throughout (they correctly stated they cannot remove a passenger T0B6 and proceeded with the requested downgrade process). Thus, there was no self-correction after an intermediate error."
taubench,deepseek-ai/DeepSeek-R1,18,b6b0103d-2586-451b-95ea-1b885478e968,True,no match,"There is no instance where the agent makes an intermediate mistake and later corrects it. From the start, the agent correctly recognized the reservation was within 24 hours and could be canceled with a full refund, and proceeded accordingly without first denying or mishandling the request T0B6. When the user later mentioned basic economy, the agent maintained the same correct stance and did not correct any earlier error; they reiterated that a full refund applies even for basic economy within 24 hours T0B8 T0B10. The final tool call in the exchange was a transfer to a human agent, which does not reflect a self-correction of a prior mistake T0B22. Therefore, this run does not exhibit self-correction."
taubench,deepseek-ai/DeepSeek-V3,21,42b9ce3a-e817-4dec-90c2-6bdecc997214,False,no match,"The agent did not demonstrate self-correction after an intermediate error. While the agent initially asked for a reservation ID and then proceeded to fetch it when the user didn’t remember it, this was a normal adjustment to proceed with the task, not a correction of a mistake or missed requirement. The agent asked for a reservation ID upfront T0B6 and the user said they didn’t have it T0B7, after which the agent retrieved the IDs from the profile T0B11. However, there was no point where the agent acknowledged an earlier error and corrected it.

Moreover, the agent assumed a refund would go to an original payment method without asking for a payment/refund method (as required by policy), and did not later correct this behavior; instead, it asserted a specific payment ID T0B25 and then proceeded to execute the update using that payment_id T0B27 without any correction. It also later referenced a different card detail (“Visa ending in 9734”) without acknowledging or fixing the inconsistency T0B28. None of these instances reflect self-correction; they indicate inconsistent or uncorrected assumptions. Therefore, this run does not match the self-correction criterion."
taubench,deepseek-ai/DeepSeek-V3,32,e0e9fd7c-8eac-4ead-9f01-6897a191a3cb,False,match,"Yes. The agent first attempted to book the reservation without including any payment method, as shown by the tool call where payment_methods was empty T0B20. The agent then recognized and explicitly stated the error—no payment method was selected—and moved to fix it T0B21. The agent asked the user to provide a new payment method to complete the booking T0B28, and the final tool call included a valid temporary payment method to complete the purchase T0B32. This demonstrates self-correction after an intermediate error, with the correction applied in the final tool call."
taubench,o4-mini-2025-04-16_low,11,4cd4cf13-6c39-40e0-a254-294320db4726,False,no match,"The agent made an intermediate error (mispricing and prematurely choosing gift card + credit card) and did not correct it in the final tool call. It first stated a $299 total and proposed paying entirely with a gift card and credit card, explicitly avoiding using the certificate T0B12 T0B12 T0B12 T0B12. The final tool call then booked using only those two payment methods, with no certificate T0B14. After that, the agent noticed a price discrepancy ($375, not $299) and proposed adding $76 from the certificate T0B15 T0B15, received confirmation T0B16, but did not make any subsequent tool call to actually apply the certificate. Instead, it claimed success and listed certificate usage without a corresponding tool action T0B17 T0B17. Because there was no corrective tool call after the error—and the final tool call still reflects the earlier mistake—this run does not demonstrate self-correction."
taubench,deepseek-ai/DeepSeek-V3,43,b4d8ff80-92c5-4cf2-8687-5b9507d530b3,True,no match,"There is no instance where the agent makes an intermediate mistake and later corrects it. The interaction proceeds linearly: the agent asks for the user and reservation IDs to modify the booking T0B6, the user provides them T0B7, the agent retrieves the reservation via a tool call T0B8 and summarizes the passengers T0B9. The user requests the name change T0B10, the agent asks for explicit confirmation before taking action T0B11, the user confirms T0B12, and the agent performs the update via the final tool call T0B13 and confirms success T0B14. At no point does the agent revise or correct an earlier error; thus, this run does not exhibit self-correction."
taubench,gemini-2.0-flash,16,a267e4b0-665c-44dd-bff5-9f0ef30f1fe2,True,no match,"The agent made an intermediate error by looking up a reservation that does not correspond to the delayed flight (queried GXWCPN) T0B15, then incorrectly claimed to have found the reservation for the delayed ATL→SEA flight HAT039 T0B16. The agent did not correct this mismatch and proceeded directly to issue compensation T0B18. There is no evidence of the agent identifying and fixing the earlier mistake before the final tool call, so this run does not exhibit self-correction."
taubench,deepseek-ai/DeepSeek-V3,39,3427a637-ee2c-49ef-813e-f4252f26d9ec,False,no match,"There is no instance of the agent making an intermediate mistake and then correcting it later. The assistant followed the required steps consistently: it asked for the user ID, reservation ID, and reason for cancellation at the outset T0B6, the user provided them T0B7, the assistant retrieved details via a tool call T0B8 and identified eligibility via insurance without contradicting earlier steps T0B9. After the user confirmed T0B10, it made the final cancellation tool call T0B11 and confirmed the refund T0B12. No self-correction behavior is evident."
taubench,gemini-2.0-flash,18,f67fdb9b-85d4-4a44-9c21-9990fd4b65f4,True,no match,"The agent does not exhibit self-correction. After collecting the user ID and reason for cancellation T0B6, the agent makes tool calls to fetch user and reservation details T0B8 T0B9. Based on that, it states the booking cannot be canceled and maintains this stance throughout T0B10 T0B12 T0B14 T0B16. The agent then offers a transfer to a human agent without revising or correcting any prior decision T0B18. There is no intermediate mistake followed by a correction, and the final tool call (reservation lookup) is not followed by any self-correcting action."
taubench,deepseek-ai/DeepSeek-V3,17,ad40995c-05d8-4d98-9b6f-dd6dcdd995e7,True,no match,"The run does not exhibit self-correction. The user requested moving the IAH→SEA flight from May 23 to May 24 and upgrading all passengers to business class, which the agent pursued consistently without an intermediate mistake that was later corrected T0B4. The final tool call was a flight search for May 24 (direct and one-stop), not a corrective action following an error T0B16 T0B16. The agent then calculated that the additional cost would exceed the user's budget T0B40, the user declined to proceed T0B47, and the agent confirmed no changes were made T0B48. There is no point where the agent identifies an earlier mistake and corrects it."
taubench,deepseek-ai/DeepSeek-V3,19,02542911-2b88-4ab5-97d8-be7cac39d3c1,False,no match,"The agent made an early mistake by agreeing to change the destination from LGA to JFK, explicitly stating they would proceed with JFK despite noting the original destination was LGA T0B9. They then continued to search and plan for JFK flights without correcting this constraint violation T0B11 and reiterated the JFK plan later T0B18. There was no subsequent acknowledgment or reversal of this error before the final tool call. The agent also assumed membership status and baggage allowance without verifying via tools, claiming the user has 0 free checked bags as a regular member, and did not correct this later T0B18. Overall, there is no evidence of self-correction after the intermediate errors; the agent persisted with the incorrect approach through the final tool call."
taubench,deepseek-ai/DeepSeek-V3,30,4d24d591-11de-4ffe-8ad6-e5ab37cfa4f3,False,no match,"There is no evidence of the agent missing a requirement early and then correcting it before the final tool call. The agent asked only which reservations to cancel T0B13, the user specified the two reservations T0B14, and the agent immediately executed cancellation tool calls as the final tool action T0B15. At no point did the agent identify and correct an earlier oversight (such as collecting a cancellation reason) before or during the final tool call; they simply proceeded and then confirmed completion T0B17."
taubench,deepseek-ai/DeepSeek-V3,23,3a12438c-4d75-4334-86f1-c394fb47c8d2,False,no match,"There is no instance where the agent discovers an earlier mistake and then corrects it. After the user later requested a cheaper option due to budget, the agent simply followed the new instruction to make the return economy, which is not the agent self-correcting a missed requirement but rather complying with a new user request T0B25 T0B26. Moreover, when executing the change, the agent’s tool call set the cabin to business for both flights, contradicting the stated plan for an economy return, and this inconsistency was not corrected before the final tool call T0B28 while the agent’s confirmation message still claimed the return was in economy T0B31. This reflects a failure to correct an error rather than successful self-correction. The agent never identified and fixed a missed requirement from earlier in the conversation (e.g., the initial request for upgrading to business for both legs T0B7 was later changed by the user, not self-corrected by the agent)."
taubench,deepseek-ai/DeepSeek-V3,29,f2994019-bfab-4df1-b98b-9ba2f5750eb3,True,no match,"The agent followed a consistent flow without correcting an earlier mistake. They asked for user ID and reason for cancellation T0B6, the user provided them (ID and reason) T0B7, the agent retrieved the account T0B8 and listed reservations T0B9. Upon the user's instruction to cancel only single-passenger reservations T0B10, the agent fetched reservation details T0B11 and then confirmed proceeding with canceling the identified ones T0B13. The final tool calls executed the cancellations T0B15. There is no point where the agent made an intermediate error and then corrected it later; the actions aligned with the user's requirement throughout."
taubench,deepseek-ai/DeepSeek-V3,13,b1fa6773-77ea-4c54-a2f9-dd0f6a2c485e,True,match,"The agent initially stated the booking could not be modified due to basic economy restrictions T0B9, missing the user's intent to change to ATL→LAS with a willingness to upgrade T0B10. The agent then self-corrected by proposing and proceeding with an upgrade to enable the change T0B11. This correction culminated in the final tool call that upgraded the cabin and replaced the return segment with the selected ATL→LAS flight HAT102 T0B29."
taubench,gemini-2.0-flash,20,08ea42fb-a2a2-4b09-9e42-b66d1d41604d,False,no match,"The agent did not self-correct before the final tool call. After the user asked to remove a checked bag and get a refund, the agent proceeded toward removal and refund, first asking for a refund method T0B26, then confirming they would remove the bag and process the refund T0B28. The final tool call actually removed the bag T0B30. Only after executing the removal did the agent state they could not process a refund, while also confirming the bag had already been removed T0B31. Since the final tool call embodied the mistake rather than correcting it, there was no self-correction."
taubench,deepseek-ai/DeepSeek-V3,48,08b8cbb0-e33c-4ead-880c-b6c54cce0db6,True,no match,"The agent did not exhibit self-correction. It initially stated that the basic economy reservation could not be modified, which is consistent with policy and not an error T0B9. After the user provided the bereavement reason, the agent offered cancellation under insurance, which is a straightforward response to new information rather than a correction of a prior mistake T0B10 T0B11. The final tool call simply cancels the reservation without revising any earlier erroneous action or claim T0B13. There is no point where the agent discovers and fixes an earlier mistake before the final tool call."
taubench,deepseek-ai/DeepSeek-V3,49,9f1eb16b-83a3-44f8-aa92-8ecac9b8c7e6,True,match,"The agent initially made an incorrect claim that the booking was within 24 hours and eligible for a full refund T0B8. After the user clarified it had been more than 24 hours T0B9, the agent corrected itself, acknowledging the 24-hour window had passed and applying the correct policy (economy without insurance cannot be cancelled) T0B10 T0B10. The final tool action was to transfer the user to a human agent to explore exceptions, following the self-correction T0B12."
taubench,deepseek-ai/DeepSeek-V3,44,c010453f-67de-462e-bb59-04fb71b2326c,False,no match,"The assistant did not exhibit self-correction. After requesting the necessary identifiers, it proceeded directly with a single reservation-details tool call and then provided baggage information without revising any earlier statements. It asked for the user ID and reservation ID to proceed T0B6, made one tool call to fetch the reservation T0B8, asserted the user's membership status based on the user's claim T0B9, and confirmed the total baggage allowance consistently thereafter T0B11. There is no point where the assistant identifies an earlier mistake and corrects it later in the conversation."
taubench,deepseek-ai/DeepSeek-V3,47,2655f2b1-ccc5-44af-9524-f43b2fbe7346,True,no match,"The agent did not exhibit self-correction. It violated the one-tool-call-at-a-time rule by issuing multiple reservation detail lookups in a single message without correction later T0B11, which conflicts with policy T0B5. It then proceeded to cancel immediately after the user identified the reservation T0B12 by calling the cancel API without first listing action details and obtaining explicit confirmation T0B13, contrary to policy T0B5. There is no later step where the agent recognizes these mistakes and corrects them. Therefore, this run does not demonstrate self-correction."
taubench,deepseek-ai/DeepSeek-V3,34,38dc57d0-ada5-489b-b922-929b03fa5e74,False,match,"The agent initially proceeded to cancel both reservations directly, issuing cancellation tool calls for XEHM4B and 59XX6W without checking for basic economy or offering an upgrade path T0B8 T0B9. After the user asked whether any flights were basic economy and indicated a willingness to upgrade before canceling T0B10, the agent corrected course by identifying XEHM4B as basic economy and moving to check the other reservation’s cabin class T0B11 T0B11. The user then explicitly requested to upgrade XEHM4B to economy and cancel it, and the agent proceeded accordingly, ultimately reporting that XEHM4B was upgraded then canceled and that 59XX6W was canceled as well T0B12 T0B32. This demonstrates the agent self-corrected its initial approach after an intermediate error."
taubench,deepseek-ai/DeepSeek-V3,35,d6f5c7d7-f412-44fc-8df8-09e5d0417e0d,True,no match,"There is no clear instance where the agent makes an intermediate mistake and later corrects it. After stating that a full refund was not possible, the agent offered a transfer to a human agent, which the user explicitly did not want, and then simply proceeded to search for alternatives without acknowledging or correcting a prior error—this is not self-correction but continuation after user pushback T0B9 T0B10. The agent also introduced a travel credit outcome without later correcting it, repeating it as final instead of recognizing any mistake T0B23 T0B31. Additionally, when the user specified a credit card ending in 8834, the final tool call used a different payment method ID and this inconsistency was never corrected T0B24 T0B25. Overall, there is no example of the agent identifying and fixing an earlier misstep prior to the final tool call."
taubench,gemini-2.0-flash,17,7c901e64-6cf0-40c8-9736-34029a5bf867,True,no match,"The agent did not self-correct after making an intermediate error. They successfully retrieved the reservation earlier T0B10, but later claimed they were unable to retrieve it and asked to reconfirm the user ID T0B22. After trying again, they still claimed failure and opted to transfer to a human agent rather than correcting the mistake T0B25. The final tool call was the transfer T0B25, and the agent never corrected their earlier erroneous inability to retrieve the reservation or computed the cost as requested T0B27. Therefore, there is no self-correction."
taubench,deepseek-ai/DeepSeek-V3,24,7c5f7e39-9637-4a6f-8641-93cf70edf9c0,True,no match,"There is no evidence that the agent missed a user requirement and later corrected it. Instead, the agent maintained a mistaken statement about baggage allowance (claiming only 1 free checked bag in business) when presenting options T0B17 and repeated this later without correction T0B29. The final tool calls were simple data lookups and did not reflect any self-correction of earlier errors T0B27, and the session concluded without changes or a fix to the earlier misinformation T0B31. Therefore, this run does not exhibit the required pattern of making an intermediate mistake and then correcting it before the final tool call."
taubench,deepseek-ai/DeepSeek-V3,4,ca1f412d-82c9-4a2d-8e78-1fcb91ef3215,False,no match,"The user explicitly said they did not have the reservation ID while requesting changes and specifying payment preference T0B7 T0B7 and later added they prefer to pay with a gift card T0B10. The agent then hallucinated a reservation ID and attempted to fetch details for ""UM3OG5"" without obtaining it from the user T0B9, and repeated the same call again T0B11. The agent also incorrectly assumed a Gold membership to determine baggage costs T0B13 and repeated that assumption later T0B16. Although the agent initially asked for a reservation ID T0B6, it did not correct the mistaken assumption about the reservation ID nor the membership status before concluding with a waiting message T0B20. There is no evidence of the agent recognizing and fixing these errors; the final tool call still relied on the hallucinated reservation ID T0B11. Therefore, this run does not exhibit self-correction."
taubench,deepseek-ai/DeepSeek-V3,3,882019ef-5d57-45dc-972f-94ddf29a2fdd,False,no match,"There is no point where the agent recognizes an earlier mistake and corrects it before the final tool call. After proposing to change the one-way booking by converting it to a round trip T0B19, the agent immediately executes a single update call without addressing any prior oversight T0B21. Notably, the user requested an extra checked bag T0B17, but the final tool call only updates flights and payment, with no separate correction to add baggage before the final action T0B21. There is no evidence of the agent identifying and fixing any earlier missteps; thus, no self-correction occurred."
taubench,deepseek-ai/DeepSeek-V3,10,ab9e8c91-eb03-4533-b854-3e974c533c0e,False,no match,"The run does not show the agent discovering and correcting an earlier mistake before the final tool call. For example, the agent claimed it would search from all NYC airports (JFK/LGA/EWR) but only executed searches from JFK and never corrected this mismatch T0B46 T0B46. The agent also asserted it had retrieved the user profile and airport list without evidence, fabricating membership and gift card details, and never corrected these later T0B44 T0B44. The final tool call proceeded with these fabricated payment IDs rather than correcting them T0B56. There is no point in the transcript where the agent recognizes these issues and fixes them prior to the final tool call; instead, it continues on the incorrect assumptions through booking T0B56. Therefore, this run does not exhibit the required self-correction."
taubench,deepseek-ai/DeepSeek-V3,22,b49200d1-c796-4933-9ee9-83d7558326b1,False,match,"The agent made an intermediate error and later corrected it. First, after retrieving the reservation, the agent asserted the Basic Economy ticket was non-changeable and did not offer the upgrade pathway to enable a change T0B14 T0B14. After the user asked about upgrading, the agent shifted to the correct approach—upgrade to economy, then change flights T0B16. The agent also prematurely attempted an update tool call with arbitrary flights T0B18 but subsequently corrected course by searching for direct flights T0B20 and presenting a valid nonstop option T0B27, then properly obtained explicit confirmation T0B29 before making the final, correct update call to switch to the selected nonstop flight T0B31. This demonstrates self-correction after an intermediate error, with the final tool call reflecting the corrected approach."
taubench,deepseek-ai/DeepSeek-R1,33,3ba11332-0d1e-47d2-8a32-c2b0d719a1c0,False,no match,"The agent did not self-correct an earlier mistake before the final tool call. Early on, the agent invented detailed reservation itineraries (origins, dates, flight numbers, durations) without any tool output providing those specifics, despite policy prohibiting this behavior T0B5. The only retrieved data at that point was the list of reservation IDs T0B10, yet the agent listed detailed trip information such as AUS→JFK with a specific date and flight number T0B12. The user then asked to cancel long flights and upgrade short ones T0B14 and reiterated the cancellation request for flights over 3 hours T0B16. The agent never asked for the required cancellation reason per policy T0B5 and proceeded to declare cancellation not allowed based on the invented details T0B17. Finally, the agent executed an upgrade on RES456 and confirmed the charge without addressing the earlier policy violation or correcting the fabricated reservation details T0B23. There is no point in the exchange where the agent recognizes and fixes the earlier errors before the final tool call, so this run does not exhibit the required self-correction."
taubench,gemini-2.0-flash,29,d01be10e-6565-455e-8c06-d2b969ec0204,True,no match,"The user asked to cancel any reservations with only one passenger T0B12. The final tool call in the run was a lookup for reservation 8C8K4E T0B13. After that, the assistant discussed details for a different reservation (UDMOP1) without making a corresponding tool call to retrieve it T0B14. There was no subsequent tool call correcting the earlier mismatch; instead, after the user insisted on proceeding T0B15, the assistant ended by transferring to a human agent T0B16. Because the agent did not fix an intermediate error via a later (final) tool call, this run does not exhibit the required self-correction."
taubench,deepseek-ai/DeepSeek-V3,14,4ff681ac-035a-48d4-a9c2-b24d906aeaab,False,no match,"There is no evidence of the agent making an intermediate mistake and later correcting it. Instead, the agent carried forward an incorrect assumption about the user's membership status, stating it was ""Regular"" when presenting baggage allowance and costs T0B18 and repeated the same assumption when proceeding to add baggage T0B22. The agent did not later recognize or correct this assumption before the final action. When the user asked to upgrade only the companion, the agent declined because all passengers on a reservation must be in the same cabin, which is consistent with policy but not a self-correction of a prior error T0B20. The final tool call only added baggage and did not rectify any earlier mistake T0B24. Therefore, this run does not demonstrate self-correction."
taubench,gemini-2.0-flash,1,8b6d54c9-dbd5-4c92-b580-44b995f6067e,False,no match,"The agent did not self-correct an earlier mistake before the final tool call. The final tool call was a simple lookup of the last reservation’s details T0B36, after which the agent reiterated that none matched and questioned the user ID T0B37, then offered a transfer rather than correcting any earlier oversight T0B39. Earlier, the agent claimed they could not proceed without the exact date or origin T0B27, but later proposed searching by user ID and destination T0B29. That search merely repeated previously listed reservations T0B9 and rechecked them again T0B31, without correcting any prior error. No missed requirement was discovered later and fixed; the agent ended by deferring to a human agent."
